dlga_mercenary_tavern_talk02:close_window|Non vedi che sono occupato? Non ho tempo né voglia di unirmi a te.^^(Hai bisogno di 150 Fama per reclutare truppe di alto livello).
dlga_mercenary_tavern_talk02:mercenary_tavern_talk|Stiamo viaggiando per queste terre, ma siamo disposti a rimanere se ci assumete, {reg59?mia signora:signore}. {reg3?Io e {reg4?{reg3} dei miei compagni ci uniremo:uno dei miei compagni ci uniremo}:Mi unirò} a voi per {reg5} peningas.
dlga_start:mercenary_after_recruited|Altri ordini, {reg59?signora:signore}?
dlga_mercenary_after_recruited:mercenary_after_recruited_2|Preparatevi. Ci muoveremo all'alba.
dlga_mercenary_after_recruited:mercenary_after_recruited_2.1|Avete del tempo per decidere. Noi resteremo in città per un pò di tempo.
dlga_mercenary_after_recruited_2:close_window|Si {reg59?signore/signora}. Noi siamo pronti, aspettiamo un vostro comando.
dlga_mercenary_tavern_talk:mercenary_tavern_talk_hire|Certamente. Assoldo tutti voi. Ecco {reg5} peningas.
dlga_mercenary_tavern_talk:mercenary_tavern_talk_hire.1|Certamente. Ma posso assoldare solo {reg6} di voi. Ecco {reg5} peningas.
dlga_mercenary_tavern_talk:tavern_mercenary_cant_lead|M'interessa. Ma attualmente non posso permettermi di assoldare nessuno.
dlga_tavern_mercenary_cant_lead:close_window|Comprendo. Bene, {reg3?noi aspetteremo:io aspetterò} qui per un pò di tempo, se cambiate idea sull'assoldare qualcuno.
dlga_mercenary_tavern_talk:tavern_mercenary_cant_lead.1|M'interessa. Ma attualmente non posso permettermi di assoldare nessuno.
dlga_mercenary_tavern_talk:close_window|Spiacente. Adesso non ho bisogno di assoldare altri uomini.
dlga_start:dungeon_reply1|Stai attento! Non mi muoverò fino a quando non sarò tutto finito.
dlga_dungeon_reply1:dungeon_reply2|Ucciderò tutti i banditi, e tu sarai libero
dlga_dungeon_reply2:close_window|Grazie {reg59?lady:sire}. Non lo dimenticherò mai! 
dlga_start:trainer_intro_11|Buon giorno a te, ragazz{reg59?a:o}. Il capitano mi ha assunto per proteggere questa barca. Qui, quando si tratta di difesa, la mia parola è legge.
dlga_trainer_intro_11:trainer_intro_21|Capisco. Tu dovresti essere il veterano. Posso imparare qualcosa sul combattimento da te?
dlga_trainer_intro_11:close_window|Piacere di conoscerti. Ritornerò più tardi.
dlga_trainer_intro_21:trainer_intro_31|Certamente. Non ho altro di meglio da fare mentre non siamo in battaglia! Posso trovarti dei combattenti per addestrarti se vuoi. O, se hai domande sulle tecniche di combattimento, chiedi pure.
dlga_trainer_intro_31:trainer_intro_41a|In effetti, avrei alcune domande.
dlga_trainer_intro_31:trainer_intro_41b|Posso iniziare ad addestrarmi.
dlga_trainer_intro_41a:trainer_talk_combat1|Bene, chiedete pure quello che vi pare.
dlga_trainer_intro_41b:trainer_practice_11|Ottimo. È bello trovare qualcuno con l'ansia di fare pratica. Vediamo quello che sapete fare.
dlga_start:trainer_practice_11|È stato un buon combattimento.
dlga_start:trainer_practice_11.1|Oh, sembra che tu abbia preso una bella botta. Non preoccuparti, anche le sconfitte hanno il loro valore purché impari la lezione. Lascia che la sconfitta resti sul campo di battaglia, alza la testa e vai avanti. Non c'è altro modo per vincere.
dlga_start:trainer_talk2|Buongiorno. Siamo pronti per l'addestramento di oggi?
dlga_trainer_pretalk2:trainer_talk2|Bene, siete pronto ad iniziare l'addestramento?
dlga_trainer_talk2:trainer_practice_11|Non vedo l'ora d'iniziare l'addestramento!
dlga_trainer_talk2:trainer_combat_begin1|Prima, ditemi qualcosa sul combattimento...
dlga_trainer_talk2:close_window|Ora devo andare via. Addio e grazie.
dlga_trainer_combat_begin1:trainer_talk_combat1|Cosa volete sapere?
dlga_trainer_combat_pretalk:trainer_talk_combat1|Cos'altro volete sapere?
dlga_trainer_talk_combat1:trainer_explain_combat|Parlatemi del combattimento.
dlga_trainer_talk_combat1:trainer_pretalk2|Conosco tutte le tecniche di combattimento di cui ho bisogno. Parliamo di qualcos'altro.
dlga_trainer_explain_combat:trainer_explain_combat_2|Bella domanda. La prima cosa che dovete conoscere come combattente è come difendervi. Tenersi lontano da possibili danni è la prima regola di combattimento, ed è molto più importante che causare danni agli altri. Tutti possono usare una spada per causare danni, ma solamente i combattenti esperti sanno anche difendersi dai colpi in arrivo.
dlga_trainer_explain_combat_2:trainer_explain_combat_3|Ora, difendersi è più facile se avete uno scudo. Bloccate gli attacchi con lo scudo. [Tieni premuto il tasto destro del mouse per alzare lo scudo e difenderti.] In questo modo, siete capace di deviare tutti gli attacchi frontali ma avrete i lati scoperti e anche dietro sarete vulnerabile.
dlga_trainer_explain_combat_3:trainer_explain_combat_4|Come faccio se non ho uno scudo?
dlga_trainer_explain_combat_4:trainer_explain_combat_5|In tal caso dovrai usare la tua arma per bloccare l'attacco dell'avversario. È un po' più difficile rispetto al difendersi con uno scudo. Difendendoti con un'arma, potrai bloccare solo un attacco che proviene da UNA direzione. Ovvero, puoi bloccare attacchi laterali o affondi. Perciò devi guardare attentamente il tuo avversario e bloccare il suo attacco subito DOPO che l'ha iniziato. Così sarai in grado di fermare l'attacco dalla giusta direzione. Se blocchi l'attacco PRIMA che l'avversario faccia la sua mossa, attaccherà da un'altra direzione mettendo a segno il colpo.
dlga_trainer_explain_combat_5:trainer_explain_combat_6|Infine, l'attacco è la miglior difesa, dicono. Una tattica che molti trovano utile è assumere una posizione offensiva e aspettare con la propria arma pronta per l'attacco, attendendo il momento propizio per sferrare il colpo. [Prepara la tua arma per l'attacco tenendo premuto il pulsante sinistro del mouse.]
dlga_trainer_explain_combat_6:trainer_explain_combat_7|Ecco una cosa utile.
dlga_trainer_explain_combat_7:trainer_explain_combat_8|È una buona tattica, ma ricordate che il vostro avversario vedrà il tipo d'attacco che state per sferrare e prenderà una posizione difensiva per contrastarvi. Se accade questo, dovete annullare il vostro attacco e rapidamente attaccare in un'altra direzione. [Puoi annullare il vostro attacco premendo rapidamente il tasto del mouse corretto.]
dlga_trainer_explain_combat_8:trainer_explain_combat_9|Se il mio avversario si sta difendendo contro la direzione in cui sto attaccando, annullerò il mio attacco ed userò un'altra direzione per il nuovo attacco.
dlga_trainer_explain_combat_9:trainer_pretalk2|Si, scegliere la direzione da cui far partire il colpo è fondamentale. Ci sono quattro colpi che puoi sferrare: tondo dritto, tondo roverso, fendente e affondo. Devi usare con sagacia ogni tipo d'attacco. [Per controllare la direzione del colpo, muovi il mouse nella direzione che si desidera e tieni premuto il pulsante sinistro del mouse].
dlga_trainer_practice_11:trainer_practice_11|Se posso dire, vedo un{reg59?a:} gran combattente in te.^^Ci sono alcuni marinai che sono rimasti inattivi, da quando abbiamo attraccato. Vediamo se qualcuno di loro ci può aiutare.
dlga_trainer_practice_11:novicemaster_are_you_ready1|Un marinaio combatterà contro di te. Sei pront{reg59?a:o}?
dlga_novicemaster_are_you_ready1:novicemaster_ready_to_fight1|Si, cominciamo.
dlga_novicemaster_ready_to_fight1:close_window|Potete iniziare. Buona fortuna.
dlga_novicemaster_are_you_ready1:novicemaster_not_ready1|Solo un momento. Devo ancora prepararmi.
dlga_novicemaster_not_ready1:close_window|Ehi, non migliori senza fare pratica!
dlga_start:close_window.88|Per favore, gentile signor{reg59?a:e}, ci aiuti! Non voglio diventare uno schiavo!
dlga_start:bodo_prisoner_sl|Ciao {playername}. Sono felice di vederti in vita. Credevo che fossi stat{reg59?a:o} uccis{reg59?a:o} quando gli uomini di Sven Collo di Toro ci hanno attaccato. Io non sono stato così fortunato, come puoi vedere.
dlga_bodo_prisoner_sl:bodo_prisoner_s2|Bodo! Cosa? Dov'è mia madre? E chi sono queste donne?
dlga_bodo_prisoner_sl:close_window|Portami via di qui, amic{reg59?a:o} mi{reg59?a:o}, e potremo parlare.
dlga_bodo_prisoner_s2:close_window|Non possiamo parlare qui; troppe orecchie ci ascoltano. Portami fuori e ti racconto tutto.
dlga_start:close_window.89|Per favore, gentile signor{reg59?a:e}, ci aiuti! Non voglio diventare uno schiavo!
dlga_start:bodo_merchant_1|Ben svegliat{reg59?a:o}, {playername}. È bello vedere che stai bene. Ci stavi mettendo ansia, quando parlavi nel sonno. Non so come farei se dovessi sopportare io quegl'incubi...
dlga_bodo_merchant_1:bodo_merchant_2|Sto bene, grazie. Non c'è bisogno di preoccuparsi.
dlga_bodo_merchant_1:bodo_merchant_21|Beh, non vedo come i fatti miei debbano interessare a chiunque altro!
dlga_bodo_merchant_2:bodo_merchant_3|Forse no. Comunque, felice di vederti viv{reg59?a:o} e veget{reg59?a:o}, amic{reg59?a:o}.
dlga_bodo_merchant_21:bodo_merchant_3|Non c'è bisogno di arrabbiarsi! Cercavo solo di essere amichevole. Sono solo contento di vederti viv{reg59?a:o} e veget{reg59?a:o}.
dlga_bodo_merchant_3:bodo_merchant_4a|Ricordami chi sei. A dire il vero, la mia testa è ancora un po' annebbiata.
dlga_bodo_merchant_3:close_window|Ti ringrazio! Ora vado a dare una mano con le navi. A dopo.
dlga_bodo_merchant_4a:bodo_merchant_5|Ebbene, io sono Bodo. Provengo dalla Cantabria, nel Regno delle Asturie, a nord di quella penisola che i Romani chiamavano Hispania. Ci siamo conosciuti molto bene durante il viaggio.
dlga_bodo_merchant_5:bodo_merchant_6|Ecco, so che mi hai già raccontato la tua storia, ma vorrei sentirla ancora.
dlga_bodo_merchant_5:close_window|Ah, giusto... Bodo. Beh, ora vado a dare una mano con le navi. A dopo.
dlga_bodo_merchant_6:bodo_merchant_7|Magari un'altra volta. Voglio tenere d'occhio l'orizzonte. Non sono sicuro quanto il capitano che fermarsi qui sia stata una buona idea.
dlga_start:close_window.90|Credevo di aver visto qualcosa poco fa, ma la nebbia su queste acque gioca dei brutti scherzi alla vista... Probabilmente non è nulla. Spero non sia nulla. La barca è veloce abbastanza, ma non abbastanza da seminare una nave da guerra.
dlga_bodo_merchant_7:bodo_merchant_8|Sono preoccupat{reg59?a:o} anch'io. Meno male che ci sei tu a controllare, amico mio.
dlga_bodo_merchant_7:close_window|Che pericolo c'è? Ma per velocizzare le cose, vado ad aiutarli con le navi.
dlga_bodo_merchant_8:close_window|È un piacere poterlo fare per te. Siamo diventati così amici durante questo viaggio, che mi dispiace doverci separare tra poco. Se ci incontreremo ancora in futuro e avrai bisogno di aiuto, lo avrai, amic{reg59?a:o} mi{reg59?a:o}.
dlga_start:esposabarco_1|{s2}^^Figli{reg59?a:o} mi{reg59?a:o}, è un così bel giorno! Il mare è così lucente! È un vero peccato che ci siano tutti questi relitti a rovinare la scena!
dlga_esposabarco_1:esposabarco_12|Sì, madre. Sono felice che tu stia bene.
dlga_esposabarco_1:esposabarco_11|Ti ricordi di me? Meraviglioso!
dlga_esposabarco_1:close_window|Ci vediamo dopo, madre.
dlga_esposabarco_12:esposabarco_13|{s2}^^Non sto solo bene, ma sono anche felice! Felice di aver fatto questa gita, ma dobbiamo aver cura di tornare a casa per cena! Tuo padre ci aspetta.
dlga_esposabarco_11:esposabarco_13|{s2}^^Sei {reg59?il mio bimbo:la mia bimba}. E io sono tua madre. Perché mai io o tuo padre dovremmo dimenticarti?
dlga_esposabarco_13:esposabarco_14|Ma... mio padre è morto.
dlga_esposabarco_13:close_window|Madre, adesso torniamo a casa. Ti voglio bene.
dlga_esposabarco_14:esposabarco_15|{s2}^^Ma... ma... non siamo qui per una gita vicino a casa? La mia testa mi fa così male, non mi ricordo dove sia casa nostra! So chi sei, ma non mi ricordo il tuo nome. Sono forse pazza?
dlga_esposabarco_15:esposabarco_16|No, hai solo dimenticato alcune cose.
dlga_esposabarco_15:esposabarco_17|No, sei solo malata. Ma presto andremo a farti visitare da qualcuno che ti farà stare meglio.
dlga_esposabarco_15:close_window|Sì, ma stiamo andando a cercare aiuto. Allora, arrivederci, per ora.
dlga_esposabarco_16:close_window|{s2}^^Oh, cielo. Ho bisosgno di stare un attimo da sola. Và, per favore.
dlga_esposabarco_17:esposabarco_18|{s2}^^Non sono così scura che qualcuno possa curarmi, figl{reg59?a:o} mi{reg59?a:o}.
dlga_esposabarco_18:close_window|Ci siamo quasi! Ti prego, non mollare adesso. Ti spiegherò meglio più tardi.
dlga_start:close_window.91|Mi piacerebbe chiacchierare, ma devo finire le mie faccende ora.
dlga_start:sailors_merchant_1|Ic grete thee, {playername}. Mi fa piacere chiacchierare, ma ho delle cose da fare ora. Parleremo più tardi.
dlga_sailors_merchant_1:close_window|Molto bene. Parleremo stasera all'attracco.
dlga_start:close_window.92|[Le guardie nemiche ti osservano attentamente dalle mura di Readingum.]
dlga_start:arquerosb_merchant_1|Vai a parlare col capo, {playername}, il veterano laggiù, a prua della nave. È quello che può addestrarti meglio a combattere.
dlga_arquerosb_merchant_1:close_window|Grazie, lo farò.
dlga_start:frisianship_merchant_1|West thu hal, {playername}. Stai bene oggi? Ti muovevi continuamente nel sonno e dicevi cose incomprensibili. I miei marinai pensavano che eri come tormentato da uno spirito.
dlga_frisianship_merchant_1:frisianship_merchant_2|Dove sono? Che posto è questo?
dlga_frisianship_merchant_2:frisianship_merchant_3|Oh, questo è male. Non ricordi niente? Il mio nome è Avo, leof. Io sono il capitano di questa nave, la Woden Ric. Imbarcasti con noi a Friese alcune settimane fa, ci hai pagato bene per prenderti con noi.
dlga_frisianship_merchant_3:frisianship_merchant_4a|Si, ora ricordo.
dlga_frisianship_merchant_3:frisianship_merchant_4b|Oh, adesso mi sta tornando in mente. Magari puoi ricordarmi perché mi trovo qui?
dlga_frisianship_merchant_4a:frisianship_merchant_5|Beh, non preoccuparti. Queste cose succedono a tutti.
dlga_frisianship_merchant_4b:frisianship_merchant_5|Ora sto davvero iniziando a preoccuparmi per te. Non conosco i dettagli, ma so che ti preoccupi per tua madre. Lei è malato, e si stavano prendendo il suo ad un prete di grande capacità di guarigione nel porto della Frisia dove stiamo andando.
dlga_frisianship_merchant_5:frisianship_merchant_6|Grazie! Ma c'è una luce fuori. Non dovremmo navigare a vele spiegate? La barca non si muove! Cosa sta succedendo? Perché ci siamo fermati?
dlga_start:close_window.93|Possiamo parlare più tardi, {reg59?signora:signore}? Ho bisogno di dare alcuni ordini ai miei uomini.
dlga_start:frisianship_merchant_talk|Buona giornata. Siamo pronti a intrecciare. Sei pronto?
dlga_frisianship_merchant_talk:frisianship_merchant_1x|Io sono pronto. Per favore, continuiamo il nostro viaggio.
dlga_frisianship_merchant_talk:close_window|No, ho bisogno di fare qualcosa prima di andarcene.
dlga_frisianship_merchant_1x:frisianship_merchant_2x|{s2}^^Siamo stati insieme in questo viaggio del tempo. Vuoi provare il timone? Lei dirige molto agilmente per una nave mercantile.
dlga_frisianship_merchant_2x:close_window|Perché, mi chiedevo quando l'avresti chiesto!
dlga_frisianship_merchant_2x:close_window.1|No. Credetemi, penso che avrebbe voluto toccarlo solo l'ultima risorsa!
dlga_frisianship_merchant_6:frisianship_merchant_7|Abbiamo trovato un po' di rottami, alcune navi metà-affondate. A quanto pare, c'era una lotta qui recentemente. Ho i miei uomini il check-out la situazione e alla ricerca di sopravvissuti. Poveri bastardi avrebbe avuto una possibilità contro le lunghe navi vichinghe. Saremo sul nostro modo abbastanza presto, anche se.
dlga_frisianship_merchant_7:frisianship_merchant_8|Oh. Potremmo abbiamo fretta lungo? Chiunque abbia affondato quelle navi potrebbe essere ancora nelle vicinanze.
dlga_frisianship_merchant_7:close_window|Bene, finalmente un po' di eccitazione! Penso che andrò a aiutarli.
dlga_frisianship_merchant_8:frisianship_merchant_9|{s2}^^Relax, {reg59?donna:uomo}. Il tuo amico, Bodo, ha insistito per la guardia. Dubito che quel tizio non trova mai una cosa del genere!
dlga_frisianship_merchant_9:frisianship_merchant_10|Bodo? Sì. Beh, sono ancora preoccupato.
dlga_frisianship_merchant_9:frisianship_merchant_11|Spero che sai quello che stai facendo.
dlga_frisianship_merchant_10:close_window|{s2}^^se tu fossi stato in una di quelle navi anziché questo, noi di smettere, ora vorreste non e ' vero? È la legge del mare -- soprattutto questo mare.
dlga_frisianship_merchant_11:close_window|Siate certi, lo faccio, {reg59?signora:signore}. Ora lasciate che tendono a questa materia, o ci potrà essere ritardato anche più a lungo.
dlga_start:frisianship_mer_1|Oh, Woden, siamo nei guai!
dlga_start:close_window.94|Possiamo parlare più tardi, {reg59?signora:signore}? Ho bisogno di dare alcuni ordini ai miei uomini.
dlga_frisianship_mer_1:frisianship_mer_2|Cos'è successo?
dlga_frisianship_mer_2:frisianship_mer_3|Shh! fai silenzio. Ascolta, siamo in pericolo. Come stavamo guardando la vostra lotta, arrivarono due navi lunghe. Ora riesco a vedere il banner. È Sven Bull-Neck. Ah, dannazione! Farai meglio a pregare a qualsiasi divinità adorate. L'inferno, si può anche pregare per coloro che non! Non importa affatto se ci becca.
dlga_frisianship_mer_3:frisianship_mer_4c|Sapevo che questo sarebbe accaduto! Non ci dovremmo essere fermati.
dlga_frisianship_mer_3:frisianship_mer_4b|Calmati, uomo! Mi dica: chi è Sven?
dlga_frisianship_mer_3:frisianship_mer_4c.1|Questa è una notizia terribile! Che cosa dobbiamo fare?
dlga_frisianship_mer_4b:frisianship_mer_4c|Non avete sentito di lui? Sven è un vichingo. Peggio ancora, di un Vichingo. Egli brucia villaggi e affonda le navi e schiavizza o uccide tutti in loro. Tutti! Ma è peggio per quello che egli sceglie per una morte orribile come un sacrificio ai suoi dei. Sentito parlare di Blodorn, l'aquila di sangue? Non volete sapere cosa vuol dire. Ora tacere.
dlga_frisianship_mer_4c:frisianship_mer_5|{s2}^^Credo che stiano passando oltre. Se rimaniamo qui, potrebbero pensare che siamo pezzi del naufragio. È la nostra sola speranza.
dlga_frisianship_mer_5:frisianship_mer_6|Che cosa? Noi dovremmo avere già stato fuga nella nebbia. Riga, gli uomini, per tutti che vale la pena!
dlga_frisianship_mer_5:frisianship_mer_6.1|Ti prego, calmati, amico mio. Noi non dobbiamo fare un torto muovetevi qui!
dlga_frisianship_mer_6:close_window|{s1}^^Sven ci ha trovati! Stanno arrivando qui! Niente per esso ma per muoversi. Tagliare il punto di ancoraggio e iniziare a remare! Oh, Woden, è inutile. Guida!
dlga_start:petro_leader_1|Saluti! Il mio nome è Petro Didaz di Oveto, e io sono un duca al servizio del re Aldefonso delle Asturie. Questi uomini sono Silo, che viene da Farum in Gallaecia, e Gundinsalvo, che proviene da Amaia, in Cantabria. Siamo sorpresi che ci avete presentato a noi con così tante navi e uomini. Vogliamo sapere chi sei.
dlga_petro_leader_1:petro_leader_3|Il mio nome è {playername}. Vengo per conto dei figli di Ragnar a negoziare con voi.
dlga_petro_leader_1:petro_leaderwessex_4|Il mio nome è {playername}. Etelredo II, il re del West Seaxe, mi manda a servire come il tuo accompagnatore al suo Regno.
dlga_petro_leader_3:petro_leader_31|Non credo che...
dlga_petro_leader_31:petro_leader_32|Figli di Ragnar sono uomini potenti e ben noti. Dovresti sentire loro proposta.
dlga_petro_leader_32:petro_leader_33|{s2}^^Sì, ascolta il loro messaggero. Dopo che canta la sua canzone, possiamo ucciderlo.
dlga_petro_leader_33:petro_leader_34|Rathbarth Ragnarsson vuole unirsi a lui e suoi fratelli contro West Seaxe.
dlga_petro_leader_33:petro_leader_34.1|Rathbarth Ragnarsson promette metà del West Seaxe se lo raggiungi.
dlga_petro_leader_33:petro_leader_34.2|Rathbarth Ragnarsson riempirà la vostra barca con ricchezze se lo raggiungi.
dlga_petro_leader_34:petro_leader_35|E se non si uniscono, cosa farà? Ucciderli? Ti ha mandato qui con una flotta di fare amicizia?
dlga_petro_leader_35:petro_leader_36|Bodo?
dlga_petro_leader_35:petro_leader_36_1|Esatto. è una tua scelta.
dlga_petro_leader_35:petro_leader_36_2|Se vi avessi voluti morti, vi avrei attaccato. Sto offrendo un'alleanza con dei colleghi vincitori.
dlga_petro_leader_36_1:petro_leader_36|{s2}^^Adoro le cose chiare e semplici. Mi piace questo tipo.
dlga_petro_leader_36_2:petro_leader_36|Ora stai parlando.
dlga_petro_leader_36:petro_leader_37|Quest{reg59?a donna:'uomo} è un{reg59?a bugiarda: bugiardo}. Ho viaggiato con l{reg59?e:u}i per molto tempo. {reg59?Le:Gli} ho offerto la mia amicizia. Ho combattuto al suo fianco e l'ho servit{reg59?a:o} fedelmente. Ma quanto fu il momento, mi tradì e consegnò la lettera ai vichinghi. Ecco perché oggi l{reg59?e:u}i è qui con quella flotta: per distruggere voi e l'alleanza tra il West Seaxe, la Franchia e l'Asturia.
dlga_petro_leader_37:petro_leader_37_1|I danesi comandano sul Nord. Ci vorrà un'alleanza per mantenere le Asturie al sicuro.
dlga_petro_leader_37:petro_leader_38_1|Il West Seaxe è debole e pronto per essere conquistato. Non vuoi unirti alla gloria e al saccheggio?
dlga_petro_leader_37:petro_leader_41|Non sono venuto fin qua per ascoltare assurdità. Qual'è la tua decisione?
dlga_petro_leader_37_1:petro_leader_37_2|Questa è la mia posizione da un po', ormai. Meglio la Danimarca che il West Seaxe. I danesi controllano praticamente tutto il nord mentre il West Seaxe riesce a malapena a tenere sotto controllo il suo stesso regno. Un'alleanza coi danesi vorrebbe dire che i vichinghi si terrebbero alla larga dalle Asturie. Magari riusciremo perfino a sguinzagliarli contro Al-Andalus.
dlga_petro_leader_37_2:petro_leader_37_3|Che cosa? Ma così il divertimento avrebbe fine. A me piace uccidere i vichinghi e tenermi le loro barche.
dlga_petro_leader_37_3:petro_leader_40|Uno che conosce veramente il nord non direbbe così. Il re dei danesi non ha il potere di controllare i vichinghi. I vichinghi sono uomini liberi che hanno adottato il mare come fonte di fama e ricchezza, e se il loro re cercasse di fermarli, si troverebbero un altro re.
dlga_petro_leader_38_1:petro_leader_38_2|Il West Seaxe può ancora lottare, e credo che lo farebbe anche bene. Canti bene, messaggero. Sarebbe buona cosa che ci spostassimo a saccheggiare altri posti, anziché la terra dei mori.
dlga_petro_leader_38_2:petro_leader_38_3|Beh, mi fa piacere sentirlo.
dlga_petro_leader_38_3:petro_leader_38_4|Stai dimenticando che il nostro re ha un'alleanza con il re del West Seaxe, è forse tua intenzione disobbedire al tuo sovrano?
dlga_petro_leader_38_4:petro_leader_40|Non farti ingannare dalle sue parole. Tutti quelli che {reg59?le:gli} danno retta fanno una brutta fine.
dlga_petro_leader_41:petro_leader_40|Ma l{reg59?a:o} senti? Avanza richieste come un{reg59?a regina: re}, e se non le si accetta, minaccia con la spada.
dlga_petro_leader_40:petro_leader_40_1|Bodo è un brav'uomo, ma ti condurrà alla distruzione se lo ascolti.
dlga_petro_leader_40:petro_leader_50|È tempo di prendere una decisione.
dlga_petro_leader_40_1:petro_leader_50|C'è stato un tempo in cui ti volevo bene e ti ammiravo. Mi hai ingannato, e non ti perdonerò mai. Arriverà il giorno in cui morirai per mia stessa mano.
dlga_petro_leader_50:petro_leader_50_1|Ho già espresso la mia opinione. I miei uomini si uniranno ai figli di Ragnar e faranno un'alleanza con i danesi a vantaggio dell'Asturia. Re Aldefonso sarà soddisfatto.
dlga_petro_leader_50_1:petro_leader_50_2|Non ho versato sangue per un regno destinato a perire. Io sto con Silo. Unisciti ai danesi e deprediamo il West Seaxe.
dlga_petro_leader_50_1:petro_leader_50_2.1|Io preferirei ammazzare i danesi anziché i sassoni... Sì, questa è la mia decisione.
dlga_petro_leader_50_2:petro_leader_51|Re Aldefonso ha nominato me, suo duca, signore delle sue armate, per completare la nostra missione di aiutare il West Seaxe. Fino ad ordine contrario, questo è il nostro obiettivo, e qualunque altra cosa è tradimento.
dlga_petro_leader_51:petro_leader_52|La vostra gente non è credibile, Duca Petro. Io sono Bodo Vimaraniz di Malacoria. Mi conoscete, sono un uomo della corte reale, e questo è il mio sigillo. Non volevo ricorrere a questo...^^Io rappresento la parola del re, qui. Ho dato ordine alla flotta del West Seaxe di attaccare la flotta di {playername}. Guardate laggiù e godetevi lo spettacolo!
dlga_petro_leader_52:petro_leader_52_2|Silo è un traditore e sarà giustiziato. Gundinsalvo adesso riunirà e imbarcherà i suoi cantabrici e si preparerà alla battaglia. Voi, Petro, lascerete alcuni uomini qui per proteggere le nostre scorte di cibo ed invierete il resto a Gundinsalvo. {playername} dovrebbe tornare alla sua nave per morire con i suoi uomini. Noi avanzeremo da qui con le nostre navi e attaccheremo a tenaglia, per porre fine a questa storia. Dopodiché ci muoveremo in aiuto del West Seaxe come concordato.
dlga_petro_leader_52_2:petro_leader_52_3|Tu non sei il re, e hai ordinato un attacco senza il nostro consenso. Questo infrange le regole. Io vado con {playername}, ma senza combattere.
dlga_petro_leader_52_3:petro_leader_53|Bodo, stupido pazzo! Stai mandando questi uomini a morire!
dlga_petro_leader_52_3:petro_leader_53.1|Ci vediamo presto.
dlga_petro_leader_53:close_window|Via con {playername}! Tutti quanti devono prepararsi alla battaglia. Gundinsalvo, vai coi tuoi uomini, ma se ci tradisci, la pagherai molto cara!
dlga_petro_leaderwessex_4:petro_leaderwessex_31|Benvenut{reg59?a:o} {playername}, ti aspettavamo diversi giorni fa.
dlga_petro_leaderwessex_31:petro_leaderwessex_32|Il re del West Seaxe ha inviato un nessuno. Questo è un insulto!
dlga_petro_leaderwessex_32:petro_leaderwessex_33|{s2}^^Tu ti offendi troppo facilmente, Silo.
dlga_petro_leaderwessex_33:petro_leaderwessex_34|Quest'uomo accanto a me, Bodo, viene dalle Asturie.
