dlga_maelbresail_aftermorrigan3:maelbresail_aftermorrigan4|--Ridacchia.--^^Ho saputo che Morrigan ha cercato di salvarsi la sua vita con le bugie. Quali sono state le sue ultime parole?
dlga_maelbresail_aftermorrigan4:maelbresail_aftermorrigan5|Ha detto di essere l'ultima discendente dei Flaithbertach.
dlga_maelbresail_aftermorrigan4:maelbresail_aftermorrigan5_2|È morta prima che potessi parlarci.
dlga_maelbresail_aftermorrigan5:maelbresail_aftermorrigan6|Lavoro per Aed mac Niall, Ard Ruire di Eriu, mi ha mandato a uccidere gli ultimi membri dei Flaithbertach al fine di eliminare potenziali rivali per il trono.
dlga_maelbresail_aftermorrigan5_2:maelbresail_aftermorrigan6|Non mentirmi! So quando stai mentendo. I Liars non hanno un posto al mio fianco, ma sulla forca!
; dlga_maelbresail_aftermorrigan6:maelbresail_aftermorrigan7|You've done a huge favor to Eriu, if you're not aware of it. This island is populated by numerous clans, but each feels entitled to rule over others. The social system is a pyramid -- the weaker subject to the stronger, but all led by the high king, the Ard Ruire. However, the elements of this system constantly mutate, and clan alliances break according to changing interests. In sum, it is very difficult to rule this land.
; dlga_maelbresail_aftermorrigan7:maelbresail_aftermorrigan8|I believe Aed mac Niall is a good leader, as he favors my interests, and therefore yours. However, Flaithbertach was a man beloved by the Ui-Neill, and his death caused much discomfort. His children could easily have taken up arms with many northern clans. As an internal war within the Kingdom of Aileach would only favor our rivals, the Southern Ui Neill, in their desire to secure once again the throne at Tara. Ard Ruire Aed is strong leader, uniquely able to keep the Vikings at bay. Do you understand?
dlga_maelbresail_aftermorrigan8:maelbresail_aftermorrigan9_1|Non dovete giustificare le vostre azioni con me.
dlga_maelbresail_aftermorrigan8:maelbresail_aftermorrigan9_2|Odio la politica.
dlga_maelbresail_aftermorrigan8:maelbresail_aftermorrigan10|Sicuro.
dlga_maelbresail_aftermorrigan9_1:maelbresail_aftermorrigan10|Giustificrmi? No, sono felice di farlo.
dlga_maelbresail_aftermorrigan9_2:maelbresail_aftermorrigan10|La politica è ciò che muove il mondo, ma è un gioco dove si vince o si muore.
; dlga_maelbresail_aftermorrigan10:maelbresail_aftermorrigan11|Everything I've done has been for the benefit of Eriu. If I had directly attacked Flaithbertach's children, they would have become martyrs, and certain northern clans could have taken up arms under that pretext. You, however, were not among my people, so nobody can associate me. You and the abbot of Finian just killing with some other malefactors. We have not seen one another many times. Now it is your name that is famous for killing the children of Flaithbertach.
dlga_maelbresail_aftermorrigan11:maelbresail_aftermorrigan12|Quindi tu mi rifiuti? Dopo tutto quello che ho fatto?
dlga_maelbresail_aftermorrigan11:maelbresail_aftermorrigan12_2|Voglio più soldi, dirò a tutti in cosa siete coinvolto.
dlga_maelbresail_aftermorrigan11:maelbresail_aftermorrigan12_3|Traditore! Le tue mani resteranno pulite mentre io sarò odiato da tutti i signori! (Intelligenza)
dlga_maelbresail_aftermorrigan11:maelbresail_aftermorrigan12_4|Beh, Morrigna è ancora viva.
; dlga_maelbresail_aftermorrigan12:maelbresail_aftermorrigan13|I never promised you anything I haven't paid. This arrangement was important to Eriu. Now, at least, I help you leave this island. Here many will hate you for killing Flaithbertach's children. I don't abandon any who has served me well, no matter how mercenary. I could reward you with 50,000 peningas. This should help you in your new life far from here.
dlga_maelbresail_aftermorrigan12_2:maelbresail_aftermorrigan13|Beh, capisco. Credo di poter pagare il tuo silenzio. Che ne dici di 100.000 denari? Questo dovrebbe aiutarti a ricostruirti una vita lontano da qui
; dlga_maelbresail_aftermorrigan12_3:maelbresail_aftermorrigan13|You're smarter than you act. I cannot lie. This much is true: many a lord has put you on his list of enemies, but it was for the good of Eriu. However, I desire to give you enough gold for your exile from Eriu. Seventy thousand peningas should be sufficient to start a new life far from here.
; dlga_maelbresail_aftermorrigan12_4:maelbresail_aftermorrigan13|Aah... I understand you're worried and will try to use anything to scare me. I know Morrigan is no longer a threat. You must leave Eriu as soon as possible, but this does not mean I not care about your welfare. I'll give you 30.000 peningas. This should be sufficient to start a new life far from here.
dlga_maelbresail_aftermorrigan13:maelbresail_aftermorrigan14|Immagino di non avere scelta. Prenderò i soldi e lascierò l'isola.
dlga_maelbresail_aftermorrigan13:maelbresail_aftermorrigan14.1|Dammi i soldi; poi deciderò cosa fare.
dlga_maelbresail_aftermorrigan13:maelbresail_aftermorrigan15|Tenetevi i vostri soldi. Voglio che tu cancelli il mio nome da questa storia.
; dlga_maelbresail_aftermorrigan14:close_window|Alright. I do not have that amount here and now. I have a farm near Temair. I will see you there and pay as agreed. In fact, I will give a banquet in your honor, for we will not meet again after that. Farewell, {playername}.
; dlga_maelbresail_aftermorrigan15:close_window|I understand. Your reputation is most important for you. I agree, I will help you to clear your name, I have strong influence in Eriu. I will use it and all money that I was going to give you. I have to think of a plan. Meanwhile, we will do this: I have a farm near Temair. I will see you there. In fact, I will give a banquet in your honor while we talk about the way to clear your name. Farewell, {playername}.
; dlga_maelbresail_pactofinal:maelbresail_pactofina2|I guess it is fair to recognize that you've exceeded all my expectations. You're much too dangerous to have as an enemy. I offer here and now peace between us. I'll pay you 50,000 peningas for all the harm I've caused you, and from this moment, our paths never cross again. You will not pursue me, and I won't send men to kill you. It will simply be as if we had never known one another. I promise before my mother, present here. Do you agree?
dlga_maelbresail_pactofina2:maelbresail_pactofina3_1|Beh, siamo entrambi uomini d'affari. Accetto i soldi. Non sentirai mai più parlare di me.
dlga_maelbresail_pactofina2:maelbresail_pactofina3_2|D'accordo, ma scambierò i soldi per il favore di Ard Ruire Aed mac Niall di Aileach.
dlga_maelbresail_pactofina2:maelbresail_pactofina3_3|Non credo. Il sangue viene pagato col sangue. Non vivrai un altro giorno.
dlga_maelbresail_pactofina3_1:maelbresail_pactofina5|No! La mia famiglia esige vendetta dalle loro tombe. Tutto ciò non può terminare senza il sangue!^^Ti ricordi di me, Mael Bresail? Ti ricordi di me, ratto? Sono venuta per ucciderti!
dlga_maelbresail_pactofina3_2:maelbresail_pactofina5|No! La mia famiglia esige vendetta dalle loro tombe. Tutto ciò non può terminare senza il sangue!^^Ti ricordi di me, Mael Bresail? Ti ricordi di me, ratto? Sono venuta per ucciderti!
; dlga_maelbresail_pactofina3_1:maelbresail_pactofina3_6|Here's your money. If ever we meet again, I do not know you. Our business is done. No more fear; no more death. May gold seal our pact, and may God witness our oaths.
; dlga_maelbresail_pactofina3_2:maelbresail_pactofina3_6|That seems fair. I shall speak highly of you to my king, and he will love you more than he loves his favorite vassal. If ever we meet again, I do not know you. Our business is done. No more fear; no more death. May God witness our oaths.
dlga_maelbresail_pactofina3_6:maelbresail_pactofina3_7|Lo giuro. La nostra ostilità è sepolta.
dlga_maelbresail_pactofina3_7:close_window|Lo giuro su mia madre. Vai in pace. Ora sei un uomo ricco.
; dlga_maelbresail_pactofina3_3:maelbresail_pactofina4|I see you're a warrior unable to see for the glints from steel, so steel shall you receive. Here. Now. Of the two, only one will leave. Men, to me!
dlga_maelbresail_pactofina4:maelbresail_pactofina5|Ti ricordi di me, ratto? Sono venuta per ucciderti, per vendicare la mia famiglia!
dlga_maelbresail_pactofina4:maelbresail_pactofina5_2|È ora che tornate dal Creatore!
dlga_maelbresail_pactofina5:close_window|--Terrorizzato--^^Tu? Ma... Uccideteli, ucciderli tutti!
dlga_maelbresail_pactofina5_2:close_window|Uccideteli, uccideteli tutti!
dlga_start:thesnake1_dialog|Somigli a un guerriero. Stai cercando lavoro?
dlga_thesnake1_dialog:thesnake2_dialog|So chi sei. Ti chiamano 'il Serpente'. Mi hanno mandato ad ucciderti.
dlga_thesnake1_dialog:thesnake2_1_dialog|Serpente, non sono qui per arruolarmi nel tuo esercito.
dlga_thesnake1_dialog:thesnake2_2_dialog|Sicuro, Serpente, quanto mi pagherai?
dlga_thesnake2_dialog:thesnake3_dialog|Perché? Ah, capisco. Non voglio scappare. Questa città ha un campo per le competizioni locali. Ti aspetterò lì con i miei uomini migliori. Vieni e porta i tuoi compagni più fedeli. Combatteremo fino alla morte.
; dlga_thesnake2_1_dialog:thesnake3_dialog|Only my enemies call me 'the Snake.' I know I am a loose thread. I represent a danger to the interests of the Rat, your patron. Coward that he is, he does not dare to come himself but sends murderers. I will not run away. This town has a field for local competitions. I'll wait there with my best men. Come and bring your most loyal companions. We will fight to the death.
dlga_thesnake2_2_dialog:thesnake3_dialog|Solo i miei nemici mi chiamano 'il Serpente'. Gli stessi che hanno distrutto la mia famiglia. Vuoi uccidermi? Non voglio scappare. Questa città ha un campo per le competizioni locali. Ti aspetterò lì con i miei uomini migliori. Vieni e porta i tuoi compagni più fedeli. Combatteremo fino alla morte.
dlga_thesnake3_dialog:close_window|Abbiamo un appuntamento.
dlga_thesnake3_dialog:thesnake4_dialog|Erm, aspetta un momento.
dlga_thesnake4_dialog:close_window|No! Se vuoi la mia testa, abbi almeno il coraggio di combattere per essa.^^[I tuoi compagni si uniranno a te in questo duello.]
dlga_start:morrigan1_dialog|Vieni a uccidermi, assassino? Il tuo signore, Mael Bresail, sarebbe felice di eliminare la mia stirpe.
; dlga_start:morriganleave_final1|{playername}, I want to thank you for all your help. Without you, I would never have avenged my family. Although the death of Mael Bresail has not given me any joy, I feel I've done the right thing. My family can now rest in peace. My travels with you are over. I leave you because I need to remove myself from the world I have known and find a place to live in peace, far away from Eriu. I need to leave behind my past to build a future, and that means leaving you.
dlga_morrigan1_dialog:morrigan1_dialog1|È giunta la tua ora, stega. Ti ucciderò.
dlga_morrigan1_dialog:morrigan1_dialog2|Di cosa vorrsti parlare, strega?
dlga_morrigan1_dialog:morrigan1_dialog3|Mael Bresail inon è il mio signore.
; dlga_morrigan1_dialog1:close_window|My father, Flaithbertach, could have been king, but he was killed by his own brother, Aed of Aileach, and your master, Mael Bresail. You plan to kill the last member from Flaithbertach's lineage. The gods and men curse your name.^^For some time now, I have owned nothing more than my life. Yet I do not fear death and think maybe it may remedy my torment.^^(Before you can do anything, Morrigan casts herself on your weapon, inviting death. She utters no sound. You watch her eyes close and peace spread across her face.)
dlga_morrigan1_dialog2:morrigan1_dialog4|Vuoi uccidermi senza sapere chi è la tua vittima o perchè devo essere uccisa, assassino?
dlga_morrigan1_dialog3:morrigan1_dialog4|Allora perchè lavori per lui e per il suo dannatissimo signore, Aed di Aileach, e uccidi i suoi nemici per lui, assassino?
dlga_morrigan1_dialog4:morrigan1_dialog5|{s10}
; dlga_morrigan1_dialog5:morrigan1_dialog6|Bal Luighne? I could have destroyed that village long ago, but never attacked. I just terrorized the locals so that they would leave the place and leave this land to me. I only seek a place to live and feel protected, but the peasants are stubborn and Mael Bresail found out where I am. Then he sent you to kill me and finish off my lineage. You may have no idea, but your patron is implacable. Recently, he sent men to kill to my brother in Pictland and his sons -- just children -- near Caer Meguaidd. Now, I am last of my family. I see it was impossible to hide from Mael Bresail. I found this remote part of the world and forgot my name by taking that of the goddess, Morrigan. Yet here you are to kill me.
dlga_morrigan1_dialog6:morrigan1_dialog1|Bugiardo! Stai tentando di confondermi. È tempo di morire.
dlga_morrigan1_dialog6:morrigan1_dialog7|Allora tu sei... la figlia di Flaithbertach? Non c'è da stupirsi che sei una minaccia!
; dlga_morrigan1_dialog7:morrigan1_dialog8|My father, Flaithbertach, could have been king, but he was killed by his own brother, your master. This is Eriu. If you want the throne, you have to catch and eliminate all potential competitors. Fratricide is practically a way of life. Aed was faster to the deed than my father. Then, with the help of Mael Bresail, he killed my mother and the rest of my family. Just my brother, his sons, and I escaped, but Mael eventually found us. Now only I am alive, but even so, now at the tip of your sword.
dlga_morrigan1_dialog8:morrigan1_dialog1|Comunque sia, avete fatto troppi danni alla gente di Bal Luighne. Pagherete con la vostra vita.
dlga_morrigan1_dialog8:morrigan1_dialog9|Mael Bresail mi ha usato? io NON sono il suo assassino!
; dlga_morrigan1_dialog9:morrigan1_dialog1|Well, that's hardly my problem. I'm tired of fleeing. Everyone I cared for is dead. I just want to see them again and be at peace. Go back to your master and collect your reward, murderer. I do not begrudge you that.
dlga_morrigan1_dialog9:morrigan1_dialog10|Mael Bresail usa tutti. Cosa vuoi fare adesso?
dlga_morrigan1_dialog10:morrigan1_dialog1|Avete fatto troppi danni alla gente di Bal Luighne. Pagherete con la vostra vita.
dlga_morrigan1_dialog10:morrigan1_dialog11|Ti lascerò vivere, prima voglio delle risposte da Mael Bresail. Tornerò.
dlga_morrigan1_dialog11:close_window|Preferisco venire con te. Hai ucciso il mio ultimo sostenitore e in ogni caso, sono stanca di nascondermi. Mi unirò a te, travestita da uno dei tuoi guerrieri.
dlga_morriganleave_final1:morriganleave_final2|Capisco. Spero troverete la pace che si desiderate.
dlga_morriganleave_final1:morriganleave_final3|Morrigan, non puoi lasciarmi. Ho bisogno di te.
; dlga_morriganleave_final2:morriganleave_final2_2|Thank you for understanding me. It has not been an easy decision. In your army, I feel protected, but this life is not for me. I need a place to call home, where I can be happy. Maybe someday we will meet again, but I think not. I just want you to know that you have become a very important person to me. I wish you luck, {playername}. The gods allow you to get everything that you deserve. You are destined for greatness.
; dlga_morriganleave_final3:morriganleave_final2_2|Do not make this difficult. My decision is made. This life is not for me. I need a place to call home, where I can be happy. Maybe someday we will meet again, but I think not. I just want you to know that you have become a very important person to me. I wish you luck, {playername}. The gods allow you to get everything that you deserve. You are destined for greatness.
dlga_morriganleave_final2_2:morriganleave_final2_3|Addio, Morrigan. Se avrai bisogno di me, verrò.
dlga_morriganleave_final2_2:morriganleave_final2_3.1|Addio, Morrigan.
dlga_morriganleave_final2_3:close_window|[Osservi Morrigan voltarti le spalle e allontanarsi da te. Gira la testa per un attimo, credi di vederle le lacrime agli occhi. Poi se ne va.] Addio, Morrigan. Se avrai bisogno di me, verrò.
dlga_start:campeon1_dialog|--Una Uomo alto, dalla faccia sorpresa, si avvicina ate.--^^Cosa erano quelle creature? Cos'è successo qui?
dlga_start:close_window.54|Addio.
dlga_campeon1_dialog:campeon1_dialog1|E tu sei?
dlga_campeon1_dialog:campeon1_dialog2|Grazie per avermi aiutato!
dlga_campeon1_dialog:campeon1_dialog3|Quelle cose erano Morrigan e i suoi servi.
dlga_campeon1_dialog1:campeon1_dialog1_1|Eh? Oh, sì... Il mio nome è Aed mac Ainmerech, e l'uomo che mi accompagna è Olchobar mac Cinaeda del Ui Neill.
dlga_campeon1_dialog1_1:campeon1_dialog3|Sono io. Siamo stati scelti per salvare Bal Luighne dal male che l'ha colpita.
dlga_campeon1_dialog2:campeon1_dialog3|il Nostro aiuto? Si tratta di pura coincidenza! Eravamo di ritorno a Bal Luighne quando abbiamo visto qualcosa nella nebbia. Abbiamo suonato i corni per segnalare che non avevamo intenzioni ostili.
; dlga_campeon1_dialog3:campeon1_dialog3_1|Was that Morrigan? With the fog, I saw demons. I was sure old Caliacas' problem was a Viking war band...
dlga_campeon1_dialog3_1:campeon1_dialog3_2|Sembri preoccupato ora, Aed, ma poche ore fa mi dicevi che potevi sconfiggere qualsiasi creatura!
dlga_campeon1_dialog3_2:campeon1_dialog3_3|Non è il momento per gli scherzi, Olchobar.^^--Si gira vero di te--^^E tu chi sei, cosa ti portain questo posto dimenticato da Dio?
dlga_campeon1_dialog3_3:campeon1_dialog4|{s10}
dlga_campeon1_dialog4:campeon1_dialog4_1|{s4}
dlga_campeon1_dialog4_1:campeon1_dialog4_2|Le vostre prestazioni sono stellari, ma purtroppo dobbiamo chiudere queta breve conversazione. Se questa è Morrigan, dobbiamo seguirla e scoprire dove si trova il suo covo.
dlga_campeon1_dialog4_2:campeon1_dialog4_3|Ma Caliacas ci ha inviato un messaggio di tornare al villaggio. Qualcosa di brutto sta per accadere...
dlga_campeon1_dialog4_3:campeon1_dialog5|Abbiamo cose più importanti da fare. Dobbiamo seguire Morrigan.
dlga_campeon1_dialog4_3:campeon1_dialog5_2|Il villaggio è più importante. Doobbiamo tornare là.
dlga_campeon1_dialog4_3:campeon1_dialog5.1|Dobbiamo separarci. Voi due andate al villaggio, io seguirò Morrigan.
dlga_campeon1_dialog4_3:campeon1_dialog5_2.1|Dobbiamo separarci. Voi due seguite Morrigan, io andrò al villaggio.
dlga_campeon1_dialog5:campeon1_dialog6|Ah! Vedo che stavi pensando a ordini mentre trascinando i piedi!
dlga_campeon1_dialog6:campeon1_dialog7|No, noi conosciamo meglio la zona. Seguiremo Morrigan. Nel frattempo, scopri cosa sta accadendo a Caliacas a Bal Luighne.
dlga_campeon1_dialog5_2:campeon1_dialog7|Sì, qualcuno deve vedere cosa sta succedendo a Caliacas a Bal Luighne. Tu vai lì mentre noi seguiamo Morrigan.
dlga_campeon1_dialog7:campeon1_dialog8|Molto bene. Ci rivedremo presto.
dlga_campeon1_dialog7:campeon1_dialog8_2|Non sono d'accordo.
dlga_campeon1_dialog8:close_window|Buona fortuna. Invieremo un messaggero appena troveremo la tana di Morrigan.
dlga_campeon1_dialog8_2:campeon1_dialog8_3|Ti sembro che mi interessi? Sei stato l'ultimo ad arrivare, così la tua missione è di ascoltare e obbedire.
; dlga_campeon1_dialog8_3:close_window|There is no need to be arrogant, Aed. Believe me, {playername}, this makes the most sense. We are from Eriu and won't waste time getting lost. We will send a messenger as soon as we find Morrigan's lair. Farewell.
dlga_start:campeon2_dialog|{nome del giocatore}! Il mio messaggero ti ha trovato. Le bestie di Morrigan ci hanno attaccato. Hanno ucciso i nostri uomini e siamo bloccati qui. Il campo di Morrigan è poco più avanti. Tu e le tue truppe siete la nostra unica speranza. Dovete tirarci fuori di qui.
dlga_start:close_window.55|Addio.
dlga_campeon2_dialog:campeon2_dialog1|Le bestie di Morrigan mi hanno attaccato.
dlga_campeon2_dialog:campeon2_dialog2|Uccideremo Morrigan insieme.
; dlga_campeon2_dialog1:campeon2_dialog3|Then they caught you here, too. We must flee before they decide to return.
dlga_campeon2_dialog2:campeon2_dialog3|Siete pazzo? Le sue bestie hanno distrutto i miei uomini. Caliacas e i suoi contadini ci hanno lasciato, cercate altri eroi. Non getterò via la mia vita in questo posto.
dlga_campeon2_dialog3:campeon2_dialog4|Il campo di Morrigan è poco più avanti. Dobbiamo ucciderla insieme. Seguimi ora!
dlga_campeon2_dialog3:campeon2_dialog4_2|Ucciderò Morrigan con o senza di voi.
dlga_campeon2_dialog4_2:close_window|Ti uccideranno, stupido, Morrigan o le sue bestie. Non verremo con te, ma rimarremo qui e aspettaremo il momento migliore per fuggire.
dlga_campeon2_dialog4:campeon2_dialog5|No. Non verremo con te. Resteremo qui e aspetteremo il momento migliore per fuggire. Se ci tieni cosi tanto a morire, fallo da solo.
dlga_campeon2_dialog5:close_window|Ratti! Tornerò a uccidervi.
dlga_campeon2_dialog5:close_window.1|Vigliacchi! Ucciderò Morrigan da solo. Addio.
dlga_start:thora_dialog|Heill! Benvenuto! Io sono Thora Ulfsdottir. Sono l'unica figlia di Ulf. Dovresti parlare con lui.
dlga_start:close_window.56|Perdonami, sono occupato.
dlga_thora_dialog:thora_dialog_sigurd|Thora, felice di conoscerti. Andrò a parlare con tuo padre. Addio.
dlga_thora_dialog:thora_dialog_romance|Thora, preferirei parlare con te di tuo padre. Sei una ragazza molto carina.
dlga_thora_dialog_sigurd:thora_dialog_sigurd2|Thora, il tuo nome è molto bello, come te. Sono Egil Horiksson. Le mie armi sono spada e lancia, ma non competono con la vostra bellezza.
dlga_thora_dialog_sigurd2:thora_dialog_sigurd2|Perché, grazie... Signore. Arrossisco ai vostri complimenti. Siete anche voi... Molto bello.
dlga_thora_dialog_sigurd2:close_window|(Consenti loro di continuare a parlare vai a parlare con Ulf)
dlga_thora_dialog_sigurd2:thora_dialog_sigurd3|Egli, lascia in pace quella ragazza, dobbiamo andare.
dlga_thora_dialog_sigurd3:close_window|Accidenti, non vuoi vedere gente felice, quando puoi? Va bene, arrivo, {reg59?signora:signore}.
dlga_thora_dialog_romance:thora_dialog_romance2|Perché, grazie... Signore. Arrossisco ai vostri complimenti. Siete anche voi... molto bello.
dlga_thora_dialog_romance:thora_dialog_sigurd|Grazie, ma dovresti parlare con mio padre, Ulf.
dlga_thora_dialog_romance2:thora_dialog_romance4|(Usa la tua capacità di persuasione per far si che Thora si interessi a te)
dlga_thora_dialog_romance2:thora_dialog_romance3|Sembri una ragazza molto intelligente. Parlami di te.
dlga_thora_dialog_romance2:thora_dialog_sigurd|Bene, alloraandrò a parlare con tuo padre. Addio.
dlga_thora_dialog_romance3:thora_dialog_sigurd|Meglio di no. A mio padre non piace che parli con degli sconosciuti. Andate a parlare con lui.
dlga_thora_dialog_romance4:thora_dialog_romance5|(I suoi occhi si illuminano mentre le parli delle tue avventure. Ti avvicini a lei e metti la tua mano su quella di lei. Non ti respinge. Tenti di baciarla, ma lei mette una mano sulla bocca.)
dlga_thora_dialog_romance5:close_window|Non qui. Mio padre si arrabbierebbe. Ti cercherò io stasera. Ora vai a vedere mio padre, Ulf.
dlga_start:close_window.57|Non ho tempo per te adesso.
dlga_start:ulf_testigo1|{playername}, cosa ci fai ancora qui?
dlga_start:ulf_ormvictory1|{s2}^^{playername}, ti ringrazio molto per aver salvato la vita, la mia fattoria e mia figlia, Thora. Voglio premiarti dandoti questi tesori. Inoltre, queste sono le armi di Orm Svarti. Penso che dovrebbero essere tue.
dlga_start:ulf_dialog|Heill! Il mio nome è Ulf Thorirsson. Il mio jarl, Sigurd Ragnarsson, mi ha comunicato che saresti venuto. Benvenuti alla mia fattoria. Voi e i vostri uomini potete mangiare e dormire qui fino a quando il popolo di Sigurd non sarà arrivato. L'unica cosa che vi chiedo è che nessuno di loro si avvicini a mia figlia, Thora.
dlga_start:ulf_dialog.1|Heill! Il mio nome è Ulf Thorirsson. Il mio jarl, Sigurd Ragnarsson, mi ha avvertito che saresti venuto. Benvenuti alla mia fattoria. Voi e i vostri uomini potete mangiare e dormire qui fino a quando il popolo di Sigurd non sarà arrivato. L'unica cosa che vi chiedo è che nessuno di loro si avvicini a mia figlia, Thora.
dlga_start:close_window.58|Sono molto occupato. I miei schiavi sono pigri.
dlga_ulf_dialog:ulf_dialog2|Grazie, Ulf. Vi prometto che nessuno toccherà vostra figlia, apprezzo la vostra ospitalità.
dlga_ulf_dialog:ulf_dialog2.1|Basta parlare di tua figlia. Datemi cibo e bevande per i miei uomini, come segno di ospitalità.
dlga_ulf_dialog2:ulf_dialog3|(Ulf diede degli ordini, e due servi uscirono fuori dalla casa con cibo e bevande. Loro diedero skvr -latte acido- e del pane con burro a te ed ai tuoi uomini.)
dlga_ulf_dialog3:ulf_dialog4|{s10}
dlga_ulf_dialog4:ulf_dialog5|È tutto quello che ho, ve lo offrò come buona volontà.
dlga_ulf_dialog5:ulf_dialog6|Sta mentendo! Ho visto barili di birra e carne di cervo in un magazzino qui vicino. Stiamo mangiando e bevendo questa merda, mentre lui tiene il meglio per se.
dlga_ulf_dialog6:ulf_dialog7|{s2}^^Sta ridendo di noi. È un uomo ricco ma ci dà il peggior pranzo. Ha trascurato le leggi dell'ospitalità! Muoia ora! Nessuno ride di Egil, servirà come esempio e gli latri ci rispetteranno.
dlga_ulf_dialog7:ulf_dialog81|{s2}2^^Se uccidi quest'uomo, dovrai pagare un alto risarcimento alla sua famiglia, o forse decideranno di vendicarsi sul vostro. È questo quello che vuoi?
dlga_ulf_dialog81:ulf_dialog8|Non ucciderlo, ma cerchia di mozzare la mano con cui tiene la spada. Non merita il Walhalla!
dlga_ulf_dialog8:ulf_dialog91|Ci è stato offerto buon cibo e da bere. Questa è la casa di Ulf e seguiremo le sue regole.
dlga_ulf_dialog8:ulf_dialog91.1|Nessuno è ancora morto. Mangiamo e beviamo quello che ci viene offerto, dovremmo essere felici di ciò.
dlga_ulf_dialog8:ulf_dialog92|Egil e Reginhard hanno ragione. Ulf ha infranto le regole di ospitalità, gli taglieremo la mano.
dlga_ulf_dialog92:ulf_dialog93|Bastardo! Sigurd Ragnarsson saprà di questo!
