dlga_maelbresail_pactofinal:maelbresail_pactofina2|Credo sia giusto riconoscere che avete superato ogni mia aspettativa.\nSiete troppo pericolos{reg59?a:o} per avervi come nemic{reg59?a:o}. Vi offro qui ed ora la pace tra di noi.\n\nVi pagherò 50.000 peningas per tutto il danno causatovi, e da questo momento, i nostri cammini mai più si incroceranno. Voi non perseguiterete me ed io non invierò i miei uomini per uccidere voi. Sarà come se non ci fossimo mai conosciuti prima. Lo prometto in presenza di mia madre, qui presente. Che ne dite?
dlga_maelbresail_pactofina2:maelbresail_pactofina3_1|Beh, siamo entrambi uomini d'affari. Accetto i soldi. Non sentirai mai più parlare di me.
dlga_maelbresail_pactofina2:maelbresail_pactofina3_2|D'accordo, ma scambierò i soldi per il favore di Ard Ruire Aed mac Niall di Aileach.
dlga_maelbresail_pactofina2:maelbresail_pactofina3_3|Non credo. Il sangue viene pagato col sangue. Non vivrai un altro giorno.
dlga_maelbresail_pactofina3_1:maelbresail_pactofina5|No! La mia famiglia esige vendetta dalle loro tombe. Tutto ciò non può terminare senza il sangue!^^Ti ricordi di me, Mael Bresail? Ti ricordi di me, ratto? Sono venuta per ucciderti!
dlga_maelbresail_pactofina3_2:maelbresail_pactofina5|No! La mia famiglia esige vendetta dalle loro tombe. Tutto ciò non può terminare senza il sangue!^^Ti ricordi di me, Mael Bresail? Ti ricordi di me, ratto? Sono venuta per ucciderti!
dlga_maelbresail_pactofina3_1:maelbresail_pactofina3_6|Ecco i vostri soldi. Se mai ci incontreremo di nuovo, non so voi. Il nostro affare è fatto. Niente più paura; niente più morte. Possa l'oro sigillare il nostro patto, e che Dio testimoni il nostro giuramento.
dlga_maelbresail_pactofina3_2:maelbresail_pactofina3_6|Mi sembra onesto. Tesserò le mie lodi per voi al mio re, ed egli vi amerà ancor più di quanto non ami il suo miglior vassallo. Io non vi conosco. Il nostro affare è concluso. Niente più paure, niente più morti.\n\nPossa Iddio testimoniare i nostri giuramenti.
dlga_maelbresail_pactofina3_6:maelbresail_pactofina3_7|Lo giuro. La nostra ostilità è sepolta.
dlga_maelbresail_pactofina3_7:close_window|Lo giuro su mia madre. Vai in pace. Ora sei un uomo ricco.
dlga_maelbresail_pactofina3_3:maelbresail_pactofina4|Vedo che sei un combattente incapace di vedere il bagliore della spada , allora è l'acciaio che riceverai. Qui. Adesso. Tra i due, solo uno uscirà vivo. Uomini, a me!
dlga_maelbresail_pactofina4:maelbresail_pactofina5|Ti ricordi di me, ratto? Sono venuta per ucciderti, per vendicare la mia famiglia!
dlga_maelbresail_pactofina4:maelbresail_pactofina5_2|È ora che tornate dal Creatore!
dlga_maelbresail_pactofina5:close_window|--Terrorizzato--^^Tu? Ma... Uccideteli, ucciderli tutti!
dlga_maelbresail_pactofina5_2:close_window|Uccideteli, uccideteli tutti!
dlga_start:thesnake1_dialog|Somigli a un guerriero. Stai cercando lavoro?
dlga_thesnake1_dialog:thesnake2_dialog|So chi sei. Ti chiamano 'il Serpente'. Mi hanno mandato ad ucciderti.
dlga_thesnake1_dialog:thesnake2_1_dialog|Serpente, non sono qui per arruolarmi nel tuo esercito.
dlga_thesnake1_dialog:thesnake2_2_dialog|Sicuro, Serpente, quanto mi pagherai?
dlga_thesnake2_dialog:thesnake3_dialog|Perché? Ah, capisco. Non voglio scappare. Questa città ha un campo per le competizioni locali. Ti aspetterò lì con i miei uomini migliori. Vieni e porta i tuoi compagni più fedeli. Combatteremo fino alla morte.
dlga_thesnake2_1_dialog:thesnake3_dialog|Solo i miei nemici mi chiamano 'la Serpe'. So bene di essere l'anello debole. Io rappresento un pericolo per gli interessi del Ratto, il vostro patrono. Da codardo qual'è, non osa neanche presentarsi di persona, ma invia degli assassini.\n\nNon intendo scappare. Questa città ha un campo per le competizioni locali. Vi aspetterò lì con i miei uomini migliori. Venite e portate i vostri compagni più fedeli. Combatteremo fino alla morte.
dlga_thesnake2_2_dialog:thesnake3_dialog|Solo i miei nemici mi chiamano 'il Serpente'. Gli stessi che hanno distrutto la mia famiglia. Vuoi uccidermi? Non voglio scappare. Questa città ha un campo per le competizioni locali. Ti aspetterò lì con i miei uomini migliori. Vieni e porta i tuoi compagni più fedeli. Combatteremo fino alla morte.
dlga_thesnake3_dialog:close_window|Abbiamo un appuntamento.
dlga_thesnake3_dialog:thesnake4_dialog|Erm, aspetta un momento.
dlga_thesnake4_dialog:close_window|No! Se vuoi la mia testa, abbi almeno il coraggio di combattere per essa.^^[I tuoi compagni si uniranno a te in questo duello.]
dlga_start:morrigan1_dialog|Vieni a uccidermi, assassino? Il tuo signore, Mael Bresail, sarebbe felice di eliminare la mia stirpe.
dlga_start:morriganleave_final1|{playername}, voglio ringraziarvi per tutto il vostro aiuto. Senza di voi non avrei mai vendicato la mia famiglia. Anche se la morte di Mael Bresail non mi donano alcuna gioia, sento di aver fatto la cosa giusta.\nI miei viaggi con voi sono finiti. Vi abbandono perché ho bisogno di fuggire dal mondo che ho conosciuto e trovare un posto dove vivere in pace, lontano da Eriu. Ho bisogno di lasciarmi il passato alle spalle e costruirmi un futuro, e ciò significa lasciarvi.
dlga_morrigan1_dialog:morrigan1_dialog1|È giunta la tua ora, stega. Ti ucciderò.
dlga_morrigan1_dialog:morrigan1_dialog2|Di cosa vorrsti parlare, strega?
dlga_morrigan1_dialog:morrigan1_dialog3|Mael Bresail inon è il mio signore.
dlga_morrigan1_dialog1:close_window|Mio padre, Flaithbertach, avrebbe potuto essere re, ma fu ucciso dal fratello, Aed di Aileach dal tuo padrone, Mael Bresail. Stai per uccidere l'ultimo membro della famiglia Flaithbertach. Gli dei e gli uomini maledicano il tuo nome.^^Da tempo, non posseggo più niente oltre la mia vita. Eppure non temo la morte ma forse tu puoi porre fine ai miei tormenti.^^(Prima che te ne accorgi, Morrigan si getta sulla tua arma, trafiggendosi. Non emette alcun suono. La guardi negli occhi mentre muore serena.)
dlga_morrigan1_dialog2:morrigan1_dialog4|Vuoi uccidermi senza sapere chi è la tua vittima o perchè devo essere uccisa, assassino?
dlga_morrigan1_dialog3:morrigan1_dialog4|Allora perchè lavori per lui e per il suo dannatissimo signore, Aed di Aileach, e uccidi i suoi nemici per lui, assassino?
dlga_morrigan1_dialog5:morrigan1_dialog6|Bal Luighne? Potrei aver distrutto quel villaggio molto tempo fa, ma non l'ho mai attaccato. Ho solo terrorizzato i locali così che se ne andassero e lasciassero la terra a me. Io cerco semplicemente un posto dove vivere e sentirmi protetto, ma i contadini sono cocciuti e Mael Bresail mi ha scovato. Quindi ha mandato te per uccidermi e mettere fine alla mia discendenza.\n\n voi non immaginate, ma il vostro patrono è implacabile. Recentemente, ha inviato degli uomini per uccidere mio fratello in Pittavia, con i suoi figlioli --solo dei bambini-- nei pressi di Caer Meguaidd. Adesso, sono l'ultimo della mia famiglia. Mi rendo conto che era impossibile nascondersi da Mael Bresail. Ho trovato questa remota parte del mondo e dimenticato il mio nome, assumendo quello della dea, Morrigan. Eppure eccovi qui ad uccidermi.
dlga_morrigan1_dialog6:morrigan1_dialog1|Bugiardo! Stai tentando di confondermi. È tempo di morire.
dlga_morrigan1_dialog6:morrigan1_dialog7|Allora tu sei... la figlia di Flaithbertach? Non c'è da stupirsi che sei una minaccia!
dlga_morrigan1_dialog7:morrigan1_dialog8|Mio padre, Flaithbertach, avrebbe potuto essere il re, ma Venne ucciso dal suo stesso fratello, il vostro maestro. Questa è Eriu. Se voi volete il trono, dovrete catturare ed eliminare tutti i potenziali competitori. Il fratricidio è praticamente uno stile di vita.\n\nAed fu più rapido ad agire rispetto a mio padre. Dopodiché, con l'aiuto di Mael Bresail, uccise mia madre e il resto della mia famiglia. Solo mio fratello, i suoi figli ed io scappammo, ma Mael alla fine ci ha trovati. Ora solo io vivo ancora, ma comunque sia, sulla punta della vostra spada.
dlga_morrigan1_dialog8:morrigan1_dialog1|Comunque sia, avete fatto troppi danni alla gente di Bal Luighne. Pagherete con la vostra vita.
dlga_morrigan1_dialog8:morrigan1_dialog9|Mael Bresail mi ha usato? io NON sono il suo assassino!
dlga_morrigan1_dialog9:morrigan1_dialog1|Beh, non è certo un mio problema. Sono stanco di scappare. Tutti coloro a cui tenevo sono morti. Desidero solo rivederli ancora e stare in pace. Tornate vittoriosi dal vostro maestro e godetevi la vostra ricompensa, assassin{reg59?a:o}. Non vi invidio per niente.
dlga_morrigan1_dialog9:morrigan1_dialog10|Mael Bresail usa tutti. Cosa vuoi fare adesso?
dlga_morrigan1_dialog10:morrigan1_dialog1|Avete fatto troppi danni alla gente di Bal Luighne. Pagherete con la vostra vita.
dlga_morrigan1_dialog10:morrigan1_dialog11|Ti lascerò vivere, prima voglio delle risposte da Mael Bresail. Tornerò.
dlga_morrigan1_dialog11:close_window|Preferisco venire con te. Hai ucciso il mio ultimo sostenitore e in ogni caso, sono stanca di nascondermi. Mi unirò a te, travestita da uno dei tuoi guerrieri.
dlga_morriganleave_final1:morriganleave_final2|Capisco. Spero troverete la pace che si desiderate.
dlga_morriganleave_final1:morriganleave_final3|Morrigan, non puoi lasciarmi. Ho bisogno di te.
dlga_morriganleave_final2:morriganleave_final2_2|Grazie per la comprensione. Non è stata una decisione facile. Nella vostra armata, mi sento protetto, ma questa vita non fa per me. Ho bisogno di un posto che io possa chiamare casa, dove io possa essere felice. Magari un giorno ci incontreremo ancora, ma non penso.^^ Voglio solo che sappiate che siete diventata una persona molto importante per me. Vi auguro molta fortuna, {playername}. Che gli dei vi concedano tutto ciò che meritate. Siete destinat{reg59?a:o} alla gloria.
dlga_morriganleave_final3:morriganleave_final2_2|Non complicate le cose. La mia decisione è presa. Questa vita non fa per me. Ho bisogno di un posto da chiamare casa, dove posso essere felice. Magari un giorno ci incontreremo ancora, ma non penso.^^Voglio solo che sappiate che siete diventata una persona molto importante per me. Vi auguro molta fortuna, {playername}. Che gli dei vi concedano tutto ciò che meritate. Siete destinat{reg59?a:o} alla gloria.
dlga_morriganleave_final2_2:morriganleave_final2_3|Addio, Morrigan. Se avrai bisogno di me, verrò.
dlga_morriganleave_final2_2:morriganleave_final2_3.1|Addio, Morrigan.
dlga_morriganleave_final2_3:close_window|[Osservi Morrigan voltarti le spalle e allontanarsi da te. Gira la testa per un attimo, credi di vederle le lacrime agli occhi. Poi se ne va.] Addio, Morrigan. Se avrai bisogno di me, verrò.
dlga_start:campeon1_dialog|--Una Uomo alto, dalla faccia sorpresa, si avvicina ate.--^^Cosa erano quelle creature? Cos'è successo qui?
dlga_start:close_window.52|Addio.
dlga_campeon1_dialog:campeon1_dialog1|E tu sei?
dlga_campeon1_dialog:campeon1_dialog2|Grazie per avermi aiutato!
dlga_campeon1_dialog:campeon1_dialog3|Quelle cose erano Morrigan e i suoi servi.
dlga_campeon1_dialog1:campeon1_dialog1_1|Eh? Oh, sì... Il mio nome è Aed mac Ainmerech, e l'uomo che mi accompagna è Olchobar mac Cinaeda del Ui Neill.
dlga_campeon1_dialog1_1:campeon1_dialog3|Sono io. Siamo stati scelti per salvare Bal Luighne dal male che l'ha colpita.
dlga_campeon1_dialog2:campeon1_dialog3|il Nostro aiuto? Si tratta di pura coincidenza! Eravamo di ritorno a Bal Luighne quando abbiamo visto qualcosa nella nebbia. Abbiamo suonato i corni per segnalare che non avevamo intenzioni ostili.
dlga_campeon1_dialog3:campeon1_dialog3_1|Quella era Morrigan? Con la nebbia, ho visto solo demoni. Ero certo che il problema del vecchio Caliacas fosse una banda di guerrieri vichinghi...
dlga_campeon1_dialog3_1:campeon1_dialog3_2|Sembri preoccupato ora, Aed, ma poche ore fa mi dicevi che potevi sconfiggere qualsiasi creatura!
dlga_campeon1_dialog3_2:campeon1_dialog3_3|Non è il momento per gli scherzi, Olchobar.^^--Si gira vero di te--^^E tu chi sei, cosa ti portain questo posto dimenticato da Dio?
dlga_campeon1_dialog4_1:campeon1_dialog4_2|Le vostre prestazioni sono stellari, ma purtroppo dobbiamo chiudere queta breve conversazione. Se questa è Morrigan, dobbiamo seguirla e scoprire dove si trova il suo covo.
dlga_campeon1_dialog4_2:campeon1_dialog4_3|Ma Caliacas ci ha inviato un messaggio di tornare al villaggio. Qualcosa di brutto sta per accadere...
dlga_campeon1_dialog4_3:campeon1_dialog5|Abbiamo cose più importanti da fare. Dobbiamo seguire Morrigan.
dlga_campeon1_dialog4_3:campeon1_dialog5_2|Il villaggio è più importante. Doobbiamo tornare là.
dlga_campeon1_dialog4_3:campeon1_dialog5.1|Dobbiamo separarci. Voi due andate al villaggio, io seguirò Morrigan.
dlga_campeon1_dialog4_3:campeon1_dialog5_2.1|Dobbiamo separarci. Voi due seguite Morrigan, io andrò al villaggio.
dlga_campeon1_dialog5:campeon1_dialog6|Ah! Vedo che stavi pensando a ordini mentre trascinando i piedi!
dlga_campeon1_dialog6:campeon1_dialog7|No, noi conosciamo meglio la zona. Seguiremo Morrigan. Nel frattempo, scopri cosa sta accadendo a Caliacas a Bal Luighne.
dlga_campeon1_dialog5_2:campeon1_dialog7|Sì, qualcuno deve vedere cosa sta succedendo a Caliacas a Bal Luighne. Tu vai lì mentre noi seguiamo Morrigan.
dlga_campeon1_dialog7:campeon1_dialog8|Molto bene. Ci rivedremo presto.
dlga_campeon1_dialog7:campeon1_dialog8_2|Non sono d'accordo.
dlga_campeon1_dialog8:close_window|Buona fortuna. Invieremo un messaggero appena troveremo la tana di Morrigan.
dlga_campeon1_dialog8_2:campeon1_dialog8_3|Ti sembro che mi interessi? Sei stato l'ultimo ad arrivare, così la tua missione è di ascoltare e obbedire.
dlga_campeon1_dialog8_3:close_window|Non c'è bisogno di essere arroganti, Aed. Credetemi, {playername}, questa è la cosa più sensata. Noi veniamo da Eriu e non butteremo via tempo perdendoci. Invieremo un messaggero non appena troveremo il rifugio di Morrigan. Addio.
dlga_start:campeon2_dialog|{nome del giocatore}! Il mio messaggero ti ha trovato. Le bestie di Morrigan ci hanno attaccato. Hanno ucciso i nostri uomini e siamo bloccati qui. Il campo di Morrigan è poco più avanti. Tu e le tue truppe siete la nostra unica speranza. Dovete tirarci fuori di qui.
dlga_start:close_window.53|Addio.
dlga_campeon2_dialog:campeon2_dialog1|Le bestie di Morrigan mi hanno attaccato.
dlga_campeon2_dialog:campeon2_dialog2|Uccideremo Morrigan insieme.
dlga_campeon2_dialog1:campeon2_dialog3|Quindi hanno catturato anche te, qui. Dobbiamo andarcene prima che decidano di tornare.
dlga_campeon2_dialog2:campeon2_dialog3|Siete pazzo? Le sue bestie hanno distrutto i miei uomini. Caliacas e i suoi contadini ci hanno lasciato, cercate altri eroi. Non getterò via la mia vita in questo posto.
dlga_campeon2_dialog3:campeon2_dialog4|Il campo di Morrigan è poco più avanti. Dobbiamo ucciderla insieme. Seguimi ora!
dlga_campeon2_dialog3:campeon2_dialog4_2|Ucciderò Morrigan con o senza di voi.
dlga_campeon2_dialog4_2:close_window|Ti uccideranno, stupido, Morrigan o le sue bestie. Non verremo con te, ma rimarremo qui e aspettaremo il momento migliore per fuggire.
dlga_campeon2_dialog4:campeon2_dialog5|No. Non verremo con te. Resteremo qui e aspetteremo il momento migliore per fuggire. Se ci tieni cosi tanto a morire, fallo da solo.
dlga_campeon2_dialog5:close_window|Ratti! Tornerò a uccidervi.
dlga_campeon2_dialog5:close_window.1|Vigliacchi! Ucciderò Morrigan da solo. Addio.
dlga_start:thora_dialog|Heill! Benvenuto! Io sono Thora Ulfsdottir. Sono l'unica figlia di Ulf. Dovresti parlare con lui.
dlga_start:close_window.54|Perdonami, sono occupato.
dlga_thora_dialog:thora_dialog_sigurd|Thora, felice di conoscerti. Andrò a parlare con tuo padre. Addio.
dlga_thora_dialog:thora_dialog_romance|Thora, preferirei parlare con te di tuo padre. Sei una ragazza molto carina.
dlga_thora_dialog_sigurd:thora_dialog_sigurd2|Thora, il tuo nome è molto bello, come te. Sono Egil Horiksson. Le mie armi sono spada e lancia, ma non competono con la vostra bellezza.
dlga_thora_dialog_sigurd2:thora_dialog_sigurd2|Perché, grazie... Signore. Arrossisco ai vostri complimenti. Siete anche voi... Molto bello.
dlga_thora_dialog_sigurd2:close_window|(Consenti loro di continuare a parlare vai a parlare con Ulf)
dlga_thora_dialog_sigurd2:thora_dialog_sigurd3|Egli, lascia in pace quella ragazza, dobbiamo andare.
dlga_thora_dialog_sigurd3:close_window|Accidenti, non vuoi vedere gente felice, quando puoi? Va bene, arrivo, {reg59?signora:signore}.
dlga_thora_dialog_romance:thora_dialog_romance2|Perché, grazie... Signore. Arrossisco ai vostri complimenti. Siete anche voi... molto bello.
dlga_thora_dialog_romance:thora_dialog_sigurd|Grazie, ma dovresti parlare con mio padre, Ulf.
dlga_thora_dialog_romance2:thora_dialog_romance4|(Usa la tua capacità di persuasione per far si che Thora si interessi a te)
dlga_thora_dialog_romance2:thora_dialog_romance3|Sembri una ragazza molto intelligente. Parlami di te.
dlga_thora_dialog_romance2:thora_dialog_sigurd|Bene, alloraandrò a parlare con tuo padre. Addio.
dlga_thora_dialog_romance3:thora_dialog_sigurd|Meglio di no. A mio padre non piace che parli con degli sconosciuti. Andate a parlare con lui.
dlga_thora_dialog_romance4:thora_dialog_romance5|(I suoi occhi si illuminano mentre le parli delle tue avventure. Ti avvicini a lei e metti la tua mano su quella di lei. Non ti respinge. Tenti di baciarla, ma lei mette una mano sulla bocca.)
dlga_thora_dialog_romance5:close_window|Non qui. Mio padre si arrabbierebbe. Ti cercherò io stasera. Ora vai a vedere mio padre, Ulf.
dlga_start:close_window.55|Non ho tempo per te adesso.
dlga_start:ulf_testigo1|{playername}, cosa ci fai ancora qui?
dlga_start:ulf_ormvictory1|{s2}^^{playername}, ti ringrazio molto per aver salvato la vita, la mia fattoria e mia figlia, Thora. Voglio premiarti dandoti questi tesori. Inoltre, queste sono le armi di Orm Svarti. Penso che dovrebbero essere tue.
dlga_start:ulf_dialog|Heill! Il mio nome è Ulf Thorirsson. Il mio jarl, Sigurd Ragnarsson, mi ha comunicato che saresti venuto. Benvenuti alla mia fattoria. Voi e i vostri uomini potete mangiare e dormire qui fino a quando il popolo di Sigurd non sarà arrivato. L'unica cosa che vi chiedo è che nessuno di loro si avvicini a mia figlia, Thora.
dlga_start:ulf_dialog.1|Heill! Il mio nome è Ulf Thorirsson. Il mio jarl, Sigurd Ragnarsson, mi ha avvertito che saresti venuto. Benvenuti alla mia fattoria. Voi e i vostri uomini potete mangiare e dormire qui fino a quando il popolo di Sigurd non sarà arrivato. L'unica cosa che vi chiedo è che nessuno di loro si avvicini a mia figlia, Thora.
dlga_start:close_window.56|Sono molto occupato. I miei schiavi sono pigri.
dlga_ulf_dialog:ulf_dialog2|Grazie, Ulf. Vi prometto che nessuno toccherà vostra figlia, apprezzo la vostra ospitalità.
dlga_ulf_dialog:ulf_dialog2.1|Basta parlare di tua figlia. Datemi cibo e bevande per i miei uomini, come segno di ospitalità.
dlga_ulf_dialog2:ulf_dialog3|(Ulf diede degli ordini, e due servi uscirono fuori dalla casa con cibo e bevande. Loro diedero skvr -latte acido- e del pane con burro a te ed ai tuoi uomini.)
dlga_ulf_dialog4:ulf_dialog5|È tutto quello che ho, ve lo offrò come buona volontà.
dlga_ulf_dialog5:ulf_dialog6|Sta mentendo! Ho visto barili di birra e carne di cervo in un magazzino qui vicino. Stiamo mangiando e bevendo questa merda, mentre lui tiene il meglio per se.
dlga_ulf_dialog6:ulf_dialog7|{s2}^^Sta ridendo di noi. È un uomo ricco ma ci dà il peggior pranzo. Ha trascurato le leggi dell'ospitalità! Muoia ora! Nessuno ride di Egil, servirà come esempio e gli latri ci rispetteranno.
dlga_ulf_dialog7:ulf_dialog81|{s2}2^^Se uccidi quest'uomo, dovrai pagare un alto risarcimento alla sua famiglia, o forse decideranno di vendicarsi sul vostro. È questo quello che vuoi?
dlga_ulf_dialog81:ulf_dialog8|Non ucciderlo, ma cerchia di mozzare la mano con cui tiene la spada. Non merita il Walhalla!
dlga_ulf_dialog8:ulf_dialog91|Ci è stato offerto buon cibo e da bere. Questa è la casa di Ulf e seguiremo le sue regole.
dlga_ulf_dialog8:ulf_dialog91.1|Nessuno è ancora morto. Mangiamo e beviamo quello che ci viene offerto, dovremmo essere felici di ciò.
dlga_ulf_dialog8:ulf_dialog92|Egil e Reginhard hanno ragione. Ulf ha infranto le regole di ospitalità, gli taglieremo la mano.
dlga_ulf_dialog92:ulf_dialog93|Bastardo! Sigurd Ragnarsson saprà di questo!
dlga_ulf_dialog93:ulf_dialog94|{s2}^^ Sarà un vero piacere!
dlga_ulf_dialog94:ulf_dialog95|Cosa sai dirmi circa il cibo e la birra?
dlga_ulf_dialog95:ulf_dialog121|Distribuite la birra e il cibo. Ulf ha infranto le regole di ospitalità, quindianche noi faremo lo stesso.
dlga_ulf_dialog95:ulf_dialog91|Nessuno toccherà il cibo e la birra. Non siamo dei ladri.
dlga_ulf_dialog91:ulf_dialog10|Stronzate! Non berrò la loro orina e non mangierò spazzatura. Non m'importa se Egil lo uccide o no. Andrò direttamente al magazzino di Ulf e prenderò quello che voglio.
dlga_ulf_dialog10:ulf_dialog11|{s2}^^Sì, buona idea, Reginhard. Lo farò anch'io. {playername} rimani con lui e bere il latte acido, se {reg59?lei:lui} se vuoi.
dlga_ulf_dialog11:ulf_dialog121|(Lasciali andare al magazzino per bere e mangiare ciò che vogliono.)
dlga_ulf_dialog11:ulf_dialog122|Reginhard e Egil, restate dove siete, o la pagherete cara.
dlga_ulf_dialog11:ulf_dialog123|Egil e Reginhard, quando prendo una decisione, voi mi ubbidite, chiaro? (Comando)
dlga_ulf_dialog123:ulf_dialog1231|{s2}^^Sì, {reg59?mia signora:mio signore}. Siamo al vostro servizio e faremo come tu comandi.
dlga_ulf_dialog1231:ulf_dialog121|Distribuite la birra e il cibo. Ulf ha infranto le regole di ospitalità, quindianche noi faremo lo stesso.
dlga_ulf_dialog122:ulf_dialog1221|Minacci i tuoi amici a proteggi un topo come Ulf, che ci ha riso in faccia. Non combatterò contro di voi, in ricordo di quello che abbiamo passato insieme, ma non mi piace la vostra decisione.
dlga_ulf_dialog1221:ulf_dialog1232|Parole giuste, Reginhard. Anche io rispetto la vostra decisione, {playername}, ma dovreste anche pensare a quanto trattate bene gli uomini che comandate...
dlga_ulf_dialog1231:ulf_dialog1232|Non toccare le scorte. Questo cibo non è nostro.
dlga_ulf_dialog121:ulf_dialog122|{s2}^^Ma questo cibo è mio e il bere pure... Siete un ladro e un brigante.
dlga_ulf_dialog122:close_window|Non è vostro. Questa fattoria appartiene ai miei uomini, mentre attendiamo l'arrivo di Sven Bull Neck.
dlga_ulf_dialog1232:ulf_dialog1233|Grazie, sono sicuro che gli dei vi ricompenseranno. Vi dirò una cosa. Sven Bull Neck non è un uomo che si sottomette facilmente, tenetevi le armi sempre a portata di mano.
dlga_ulf_dialog1233:close_window|lo farò. Ora vado a sistemare i miei uomini e aspetterò fino a quando arriverà Sven Bull Neck.
dlga_ulf_ormvictory1:ulf_ormvictory21|Ulf, conservate queste spoglie per il futuro figlio di Thora, e raccontategli qualcosa riguardo a suo padre.
dlga_ulf_ormvictory1:ulf_ormvictory2|Ulf, prendete questi soldi e questi oggetti per il futuro bambino di Thora. Sarei contento se li accettaste.
dlga_ulf_ormvictory1:ulf_ormvictory2.1|Ulf, prendete questo denaro per il futuro bambino di Thora. Sarà contento di tenere la spada e l'armatura di Orm.
dlga_ulf_ormvictory1:ulf_ormvictory3|Grazie, Ulf, I tuoi doni sono ben accetti.
dlga_ulf_ormvictory21:ulf_ormvictory2|Assicurati che il bambino sappia chi è suo padre, io me lo ricorderò sempre.
dlga_ulf_ormvictory2:ulf_ormvictory4|Sei un uomo generoso. Spero che sarete prosciolto all'Assemblea. La mia casa è la tua casa. Addio.
dlga_ulf_ormvictory3:ulf_ormvictory4|Spero che gli Spiriti del Fato ti siano benevoli.
dlga_ulf_ormvictory4:close_window|Non vi è dubbio che la tua fortuna supera quella di molti altri. Tu, amico mio, sei destinato per essere un grande o per dare grandezza a chi ti ucciderà. Hai battuto un famigerato berserker. Hai il mio rispetto e la mia ammirazione.
dlga_ulf_testigo1:ulf_testigo2|Ulf, voglio convincervi a non testimoniare contro di me all'Assemblea.
dlga_ulf_testigo1:close_window|Sono solo di passaggio. Volevo solo salutarti. Addio.
dlga_ulf_testigo2:ulf_testigo3|Preferisco parlare di mia figlia. Lei è incinta di un vostro bambino, un bambino illegittimo, di un uomo senza futuro. Hai disonorato la mia casa e mia figlia. Presenterò il mio caso all'Assemblea.
dlga_ulf_testigo2:ulf_testigo3.1|Preferisco parlare di mia figlia. Lei è incinta del vostro compagno, Egil, un bambino illegittimo, di un uomo senza futuro. Hai disonorato la mia casa e mia figlia. Presenterò il mio caso all'Assemblea.
dlga_ulf_testigo2:ulf_testigo3.2|Preferisco parlare di mia figlia. Lei è incinta per colpa di uno dei tuoi uomini, cha l'ha rapita nella notte dopo aver bevuto troppo idromele. Hai disonorato la mia casa e mia figlia. Presenterò il mio caso all'Assemblea.
dlga_ulf_testigo3:ulf_testigo41|Scusatemi, non ne avevo idea. La sposerò.
dlga_ulf_testigo3:ulf_testigo42|Scusatemi, non ne avevo idea. Egil la sposerà.
dlga_ulf_testigo3:ulf_testigo43|Questo è terribile. Scegliete un uomo nella mia compagnia ed egli la sposerà.
dlga_ulf_testigo3:ulf_testigo44|Capisco. Prenderò tua figlia con me.
dlga_ulf_testigo3:ulf_testigo6|È stato uno spiacevole incidente. Mettiamoci d'accordo sul guidrigildo a titolo di risarcimento.
dlga_ulf_testigo3:ulf_testigo46|Sicuro che questo bambino non sia semplicemente figlio di uno dei tuoi schiavi?
dlga_ulf_testigo41:ulf_testigo5|Sposare? Mia figlia? No, tu sei di una classe inferiore a lei, poi, presto sarete morti. Tutti sanno che Sigurd Ragnarsson chiederà la testa durante l'Assemblea.
dlga_ulf_testigo43:ulf_testigo5|Con uno dei tuoi uomini? Forse pensi che sia una puttana. Dite qualcosa di sensato o andatevene fuori da qui.
