dlga_svenbn_hunting3:close_window|Buona fortuna, {playername}, broedr. Non ho mai conosciuto nessuno con la vostra fortuna o il vostro destino. Sicuramente, siete un soguligr, una persona degna di essere menzionata nelle saghe. Vel Far thu!
; dlga_svenbn_hunting3:close_window.1|Good luck, {playername}. God is with you, because without His help it would be impossible that someone might do the deeds that you have done. Wes gesund!
dlga_reclutar_permiso1:lord_talk|{s10}
dlga_lord_talk:offer_gift_quest_complete|Ho il comprato tutto per il regalo di {s4}.
dlga_lord_talk:intrigue_quest_state_complaint|Mio signore... Desidero dirvi una cosa in privato, su uno dei vostri vassalli.
dlga_intrigue_quest_state_complaint:lord_pretalk|Qualunque cosa abbiate da dire, vi chiedo di aspettare fino a quando saremo soli.
dlga_intrigue_quest_state_complaint:intrigue_quest_state_complaint_plyr|Cosa vorreste dire affermando ciò? Apprezzo la vostra opinione, anche se spero che non stiate cercando di seminare discordia tra i miei vassalli.
dlga_intrigue_quest_state_complaint_plyr:lord_intrigue_quest_complaint_stated|Mio sovrano, {s4} è largamente risaputo tra i vostri vassalli essere {s5}, e uno svantaggio per il vostro reame.
dlga_intrigue_quest_state_complaint_plyr:lord_pretalk|Veramente, mio signore, non importa.
dlga_lord_intrigue_quest_complaint_stated:lord_pretalk|Hmm... Questo è preoccupante da sentire. Anche se non incoraggio i miei vassalli a parlar male l'uno dell'altro, apprezzo la vostra opinione. Forse dovrei pensarci due volte sul concedere a {s4} ulteriori feudi o uffizi...
dlga_lord_intrigue_quest_complaint_stated:intrigue_quest_state_complaint_failed|Volete seminare discordia tra i miei vassalli? Con tutto quello che sta succedendo, pensate che apprezzi il fatto che voi istighiate i miei nobili a litigare come cani? Lasciate che vi chieda una cosa -- Chi ci guadagna in tutto questo?
dlga_intrigue_quest_state_complaint_failed:intrigue_quest_state_accept_blame|Sono parole mie, mio signore.
dlga_intrigue_quest_state_complaint_failed:intrigue_quest_state_deflect_blame|Si sire, {s4} mi ha chiesto di denunciare {s5}!  
dlga_intrigue_quest_state_accept_blame:lord_pretalk|Indecente. Potete pensare a qualcosa, ma serbatela per voi stesso. Non voglio sentire le vostre critiche negative sul mio fedele seguace {s4}.
dlga_intrigue_quest_state_deflect_blame:lord_pretalk|Ci ho riflettuto molto. Ho un consiglio per voi, {reg59?ragazzina:ragazzino} -- Non ficcate il naso negli affari degli altri. Ne ho abbastanza.
dlga_lord_talk:lord_denounce_1|Voglio dirvi una cosa... Ne abbiamo abbastanza del vostro modo di fare {s4}.  
dlga_lord_denounce_1:lord_denounce_2|Scusate... Che cos'avete detto?
dlga_lord_denounce_2:lord_denounce_3|Mi avete sentito. Voi sareste {s4}
dlga_lord_denounce_2:lord_pretalk|Non importa. Dovete aver sentito male.
dlga_lord_denounce_3:close_window|Perché dite una cosa simile? Per insultarmi così, in spregio alla nostra amicizia... Quanto è più crudele un coltello nella schiena da un ex amico, che la spada di un nemico giurato... Non so a che gioco stiate giocando, ma non voglio averci a che fare. Andatevene. Non voglio più vedervi!
dlga_lord_denounce_3:close_window.1|Humph. Davvero? È questa la vostra opinione, o è stato uno dei miei rivali a mettervi queste parole in bocca? Non importa. Non voglio stare al vostro gioco. Andatevene e portate i vostri intrighi via con voi.
dlga_lord_denounce_3:lord_denounce_4|Non voglio svergognarvi in pubblico, {reg59?mia signora:signore}. Ritirate le vostre parole o dovrò sfidarvi in duello.
dlga_lord_denounce_3:lord_denounce_4.1|È così? Beh, sentite questo: Siete una serpe, e una persona disonesta, e se non m'incontrerete sul terreno del duello, anche una persona dotata di vigliaccheria. Che ne dite di questo? Volete ritirare le vostre parole, o dobbiamo incrociare le spade?
dlga_lord_denounce_4:lord_respond_to_insult_challenge_duel_confirm|Sarà un piacere combattere contro di voi.
dlga_lord_denounce_4:lord_denounce_retract|Ho parlato avventatamente. Ritiro le mie parole.
dlga_lord_denounce_retract:lord_pretalk|Ci ho pensato abbastanza. Ora andiamocene via da qui.
dlga_lord_talk:lord_respond_to_insult|{s9}
dlga_lord_talk:lord_quarrel_intervention_1|Desidero appianare il vostro dissidio con {s11}
dlga_lord_talk:lord_recruit_1_relation|Fermate la vostra mano! C'è qualcosa di cui vi voglio parlare in privato!
dlga_lord_talk:lord_gift_improverelation|(Donagli anelli e bracciali da guerriero per un valore di 5000 denari)
dlga_lord_gift_improverelation:lord_pretalk|Grazie, sono orgoglioso di ricevere questi doni.
dlga_lord_talk:lord_bandit_information|Sto inseguendo un gruppo di banditi che corrispondono a questa descrizione... Li avete visti?
dlga_lord_bandit_information:lord_pretalk|{s15}
dlga_lord_talk:lord_internal_politics_cur_stance|Chi pensate che dovrebbe essere il Comandante in Capo del nostro regno?
dlga_lord_talk:lord_internal_politics_cur_stance.1|Chi pensate debba ricevere il feudo di {s4}?
dlga_lord_talk:lord_husband_auto_recruit|Ho bisogno che rinunciate alla vostra obbedienza a {s4} e vi uniate a {s5} adesso, marito mio.
dlga_lord_husband_auto_recruit:lord_pretalk|Chiedetemelo nuovamente quando saremo fuori da queste mura, moglie mia.
dlga_lord_husband_auto_recruit:close_window|Come desiderate, moglie mia.
dlga_lord_talk:reclutar_permiso1|Vorrei chiedervi il permesso di reclutare uomini nelle vostre terre.
dlga_lord_talk:lord_recruit_1_relation.1|C'è una questione di cui desidero discutere con voi in privato.
dlga_lord_talk:lord_reveal|Recentemente, hanno tentato di assassinarmi e mi è giunta voce che voi ne eravate il mandante.
dlga_lord_talk:lord_recruit_1_relation.2|C'è qualcosa di cui vorrei discutere con voi in privato.
dlga_lord_talk:lord_talk|CHEAT -- Reset lord decision seed and intrigue impatience
dlga_lord_talk:lord_respond_to_insult_challenge_duel|CHEAT -- Let's duel (insult)
dlga_lord_respond_to_insult:lord_pretalk|Hah! Io ammiro una lingua tagliente. Forse un giorno ve la farò tagliare, con le pinze, per ammirarla nel tempo libero, ma almeno oggi io saluto il vostro ingegno e coraggio.
dlga_lord_respond_to_insult:lord_pretalk.1|Non volevo offendere, madama.
dlga_lord_respond_to_insult:lord_respond_to_insult_challenge_battle|State cercando di provocarmi? Bene, voglio che sappiate che non sono obbligato a duellare contro donne, borghesi, ribelli o briganti. Tuttavia potrei ordinare ai miei uomini di prendervi e frustrarvi. Vi piacerebbe che lo facessi?
dlga_lord_respond_to_insult:lord_respond_to_insult_challenge_duel|State cercando di provocarmi? Bene, voglio che sappiate che non sono obbligato a duellare contro donne, borghesi, ribelli o briganti. Tuttavia, nel vostro caso sarei felice di fare un'eccezione. Siete pronta, in ossequio ai vostri scommettitori, {reg59?ragazza:varlot}?
dlga_lord_respond_to_insult:close_window|State cercando di provocarmi? Bene, voglio che sappiate che non sono obbligato a duellare contro donne, borghesi, ribelli o briganti. Siete fortunato che sono di buon umore, perché rientrerebbe nei miei diritti ordinare ai miei uomini di prendervi e fustigarvi. Adesso andatevene, ne ho abbastanza di voi!
dlga_lord_respond_to_insult_challenge_battle:lord_respond_to_insult_challenge_battle_confirm|Fateli provare e vediamo se ci riescono.
dlga_lord_respond_to_insult_challenge_battle:close_window|Questo non vale uno spargimento di sangue.
dlga_lord_respond_to_insult_challenge_battle_confirm:close_window|Basta con la vostra insolenza! Addosso, ragazzi!
dlga_lord_respond_to_insult_challenge_duel:lord_respond_to_insult_challenge_duel_confirm|Sono pronto a darvi una lezione.
dlga_lord_respond_to_insult_challenge_duel:close_window|Questo non vale uno spargimento di sangue.
dlga_lord_respond_to_insult_challenge_duel_confirm:close_window|Così sia. Difendetevi!
dlga_lord_quarrel_intervention_1:lord_quarrel_intervention_2|{s14}
dlga_lord_quarrel_intervention_2:lord_quarrel_intervention_3a|Ah, bene. Sembra che abbiate ragione.
dlga_lord_quarrel_intervention_2:lord_quarrel_intervention_3b|Quali che siano le vostre divergenze, voglio che le risolviate.
dlga_lord_quarrel_intervention_2:lord_quarrel_intervention_3b.1|Non posso convincervi ad appianare le vostre divergenze?
dlga_lord_quarrel_intervention_2:lord_pretalk|Ci ho ripensato, non voglio averci niente a che fare.
dlga_lord_quarrel_intervention_3a:lord_pretalk|Sono contento che lo pensiate.
dlga_lord_quarrel_intervention_3b:lord_quarrel_intervention_4|Per rispetto alla nostra amicizia, mi rimetto al vostro giudizio. Proverò a far pace con {s11}.
dlga_lord_quarrel_intervention_3b:lord_pretalk|Non mi riconcilierò con {s11}. Conosco i miei diritti.
dlga_lord_quarrel_intervention_4:lord_pretalk|Sia come se il nostro litigio non fosse mai avvenuto.
dlga_lord_quarrel_intervention_4:lord_pretalk.1|Credo che dobbiate parlare anche con {s11}, e vedere se egli farà lo stesso per me.
dlga_lord_internal_politics_cur_stance:lord_internal_politics_cur_stance_plyr_response|Avevo già intenzione di darvi il mio supporto.
dlga_lord_internal_politics_cur_stance:lord_internal_politics_cur_stance_plyr_response.1|Non sono in grado di decidere adesso
dlga_lord_internal_politics_cur_stance:lord_internal_politics_cur_stance_plyr_response.2|Io appoggio {s15}. {s10}
dlga_lord_internal_politics_cur_stance_plyr_response:lord_internal_politics_plyr_choose_candidate|Lasciate che vi dica chi io appoggio...
dlga_lord_internal_politics_cur_stance_plyr_response:lord_internal_politics_cur_stance_plyr_response|TRUCCO -- Cancella supporto
dlga_lord_internal_politics_plyr_choose_candidate:lord_internal_politics_plyr_choose_candidate_select|A chi darete il vostro appoggio?
dlga_lord_internal_politics_plyr_choose_candidate_select:lord_internal_politics_pretalk|Vorrei candidare me stesso per questo onore.
dlga_lord_internal_politics_plyr_choose_candidate_select:lord_internal_politics_pretalk.1|Io appoggio mio marito, {s4}
dlga_lord_internal_politics_plyr_choose_candidate_select:lord_internal_politics_support_acknowledge|Vorrei sostenere voi, {s4}
dlga_lord_internal_politics_plyr_choose_candidate_select:lord_internal_politics_support_same_acknowledge|Vorrei appoggiare la vostra scelta, {s4}
dlga_lord_internal_politics_plyr_choose_candidate_select:lord_pretalk|Non importa
dlga_lord_internal_politics_support_acknowledge:lord_pretalk|È molto gentile da parte vostra, ma io non cerco l'onore, e declino il vostro supporto.
dlga_lord_internal_politics_support_acknowledge:lord_pretalk.1|Non ho fiducia in voi, e non ho bisogno del vostro appoggio.
dlga_lord_internal_politics_support_acknowledge:lord_pretalk.2|È molto gentile da parte vostra.
dlga_lord_internal_politics_support_same_acknowledge:lord_pretalk|Potete anche dirgli voi stesso. Non vi credo e non avrò parte nel gioco che state orchestrando.
dlga_lord_internal_politics_support_same_acknowledge:lord_pretalk.1|Dati i vostri rapporti con {s4}, non credo che gradirebbe il vostro supporto.
dlga_lord_internal_politics_support_same_acknowledge:lord_pretalk.2|Io farò il nome di {s4}. Senza dubbio vi sarà grato del vostro supporto.
dlga_lord_internal_politics_plyr_choose_candidate_select:lord_internal_politics_pretalk.2|Io appoggio {s4}
dlga_lord_internal_politics_pretalk:lord_internal_politics_cur_stance_plyr_response|Ah, molto interessante.
dlga_lord_internal_politics_cur_stance_plyr_response:lord_internal_politics_plyr_request_support|Posso convincervi a dare il vostro supporto a me?
dlga_lord_internal_politics_cur_stance_plyr_response:lord_pretalk|Comunque, basta con la politica per il momento.
dlga_lord_internal_politics_plyr_request_support:lord_pretalk|Avete ingenerato troppe polemiche per essere un valido candidato per adesso. Vi consiglio di aspettare un pò di tempo prima di chiedere qualsiasi altra onorificenza per voi.
dlga_lord_internal_politics_plyr_request_support:lord_pretalk.1|Mi dispiace. Non vorrei rovinare il mio rapporto con {s4}
dlga_lord_internal_politics_plyr_request_support:lord_pretalk.2|Direi che siate abbiate già ricevuto sufficienti ricompense con feudi adeguati ai vostri meriti.
dlga_lord_internal_politics_plyr_request_support:lord_pretalk.3|Penso che dovreste dimostrare ulteriormente il vostro valore prima di aver diritto ad essere eletto a questa posizione.
dlga_lord_internal_politics_plyr_request_support:lord_pretalk.4|Hmm... Chiedete troppo, visto lo stato delle vostre relazioni.
dlga_lord_internal_politics_plyr_request_support:lord_pretalk.5|Vi darei il mio appoggio con piacere.
dlga_lord_recruit_1_relation:lord_pretalk|La mia mente è esausta nel parlare di politica. Forse un'altra volta.
dlga_lord_recruit_1_relation:lord_pretalk.1|{s12}
dlga_lord_recruit_1_relation:lord_recruit_pretender|Avete aumentato il livello di ribellione a favore di {s16}. Siete venuto a perorare la {reg3?sua:sua} causa?
dlga_lord_recruit_pretender:lord_recruit_3_dilemma_1|Si.
dlga_lord_recruit_pretender:lord_recruit_1_relation|No, non è questo. C'è un'altra questione che vorrei discutere...
dlga_lord_recruit_1_relation:lord_pretalk.2|{s12}
dlga_lord_recruit_1_relation:lord_recruit_2|{s12}
dlga_lord_recruit_2:lord_recruit_2_philosophy|Cosa pensate, in termini generali, sui Re, i signori e la politica?
dlga_lord_recruit_2:lord_spouse_leave_faction|Marito mio, credo che dovreste ripensare alla vostra alleanza con {s11}
dlga_lord_spouse_leave_faction:lord_spouse_leave_faction_2|{s9} è sempre stato un sovrano buono con me, ma io vi sento perplessa. Cosa suggerite di fare?
dlga_lord_spouse_leave_faction:lord_spouse_leave_faction_2.1|Non vedo ragioni particolari per abbandorare {s9}, ma io ascolto il vostro consiglio. Cosa suggerite di fare?
dlga_lord_spouse_leave_faction:lord_spouse_leave_faction_2.2|Si, come sovrano {s9} è una grande delusione. Cosa consigliate di fare?
dlga_lord_spouse_leave_faction_2:lord_spouse_leave_faction_husband_king|Credo che dovreste essere Re, marito mio!
dlga_lord_spouse_leave_faction_2:lord_spouse_leave_faction_proclaim_queen|Sono la legittima Regina delle Terre del Nord
dlga_lord_spouse_leave_faction_2:lord_pretalk|Non importa
dlga_lord_spouse_leave_faction_husband_king:lord_pretalk|Forse un giorno, moglie mia. Ma prima di proclamarmi Re e uscire pubblicamente allo scoperto, vorrei che uno di noi ottenesse una fortezza dove poter tener corte.
dlga_lord_spouse_leave_faction_proclaim_queen:lord_pretalk|Anche se non contesto il vostro diritto a regnare, moglie mia, vorrei che uno di noi ottenesse una fortezza dove poter tener corte prima di dichiararci pubblicamente.
dlga_lord_spouse_leave_faction_proclaim_queen:lord_spouse_leave_faction_proclaim_queen_confirm|{s11}
dlga_lord_spouse_leave_faction_proclaim_queen:lord_pretalk.1|{s11}
dlga_lord_spouse_leave_faction_proclaim_queen_confirm:close_window|Sono pronta, marito mio. Andiamo avanti nel reclamare il nostro trono!
dlga_lord_spouse_leave_faction_proclaim_queen_confirm:lord_pretalk|Forse non sono ancora pronto.
dlga_lord_spouse_leave_faction_husband_king:lord_pretalk.1|Forse, ma avrei bisogno del vostro pieno supporto per portare avanti questa pretesa al trono. Vi consiglio di sistemare prima la ribellione di {s4} e solo dopo di spingere ulteriormente verso la regalità.
dlga_lord_spouse_leave_faction_husband_king:lord_spouse_leave_faction_husband_king_2|La maggior parte delle grandi famiglie di questa terra hanno diritto al trono... Date le recenti vicende sulla successione, sarei un Re legittimo come {s4}.
dlga_lord_spouse_leave_faction_husband_king_2:lord_spouse_leave_faction_husband_king_3|Anche se sono il Re, mi rimetto al vostro giudizio circa nomina dei ministri, l'indirizzo della diplomazia e altre questioni simili.
dlga_lord_spouse_leave_faction_husband_king_3:close_window|Molto bene, marito mio. Andiamo avanti con la vostra rivendicazione al trono!
dlga_lord_spouse_leave_faction_husband_king_3:lord_pretalk|In realtà è meglio attendere ancora un pò.
dlga_lord_recruit_2_philosophy:lord_recruit_2|{s43} Desiderate parlare di qualcos'altro?
dlga_lord_recruit_2:lord_recruit_2_discontent|Cosa pensate di {s15}?
dlga_lord_recruit_2:lord_recruit_3_a|Vi ricordate di quello che vi avevo detto prima?
dlga_lord_recruit_2:lord_recruit_quarrel_describe|Ho sentito che avete una disputa con {s16}
dlga_lord_recruit_quarrel_describe:lord_recruit_2|Non è un mistero. {s14}
dlga_lord_recruit_2:lord_pretalk|Non importa
dlga_lord_recruit_2_discontent:lord_recruit_2_discontent_b|{s12}
dlga_lord_recruit_2_discontent:lord_recruit_hesitant|{s12}
dlga_lord_recruit_2_discontent_b:lord_recruit_3|Qualche volta sono in ansia per la situazione di questo regno.
dlga_lord_recruit_hesitant:lord_recruit_hesitant_persuade|Posso convincervi a dirmi qualcosa di più?
dlga_lord_recruit_hesitant:lord_pretalk|Ah. Molto bene.
dlga_lord_recruit_hesitant_persuade:lord_recruit_3|Se la mettete in questo modo, devo ammettere che a volte provo preoccupazione per la situazione del regno.
dlga_lord_recruit_hesitant_persuade:lord_pretalk|Mettete alla prova la mia pazienza. Vi ho detto che non abbiamo nulla di cui parlare!
dlga_lord_recruit_3:lord_recruit_3_a|Bene, ho qualcosa da dirvi.
dlga_lord_recruit_3:lord_pretalk|Ah, questo è interessante. Ma basta parlare di politica.
dlga_lord_recruit_3_a:lord_recruit_3_reset_claim|{s12}
dlga_lord_recruit_3_reset_claim:lord_recruit_3_claim|Si, è così.
dlga_lord_recruit_3_reset_claim:lord_recruit_3_a_reset|Fatemelo dire in maniera differente.
dlga_lord_recruit_3_a:lord_recruit_3_b|Si?
dlga_lord_recruit_3_a_reset:lord_recruit_3_b|Si?
dlga_lord_recruit_3_b:lord_recruit_3_why|Chiedo il vostro supporto per il trono delle Terre del Nord.
dlga_lord_recruit_3_b:lord_recruit_3_why.1|Vi chiedo di giurare fedeltà al mio signore, {s45}, come monarca di tutte le Terre del Nord.
dlga_lord_recruit_3_b:lord_pretalk|Non importa
dlga_lord_recruit_3_dilemma_1:lord_recruit_3_dilemma_2|{s43}
dlga_lord_recruit_3_dilemma_2:lord_recruit_3_why|{s43}
dlga_lord_recruit_3_why:lord_pretalk|Nessuno di noi possiede neppure una fortezza. Vorreste governare il vostro regno da un nascondiglio di fuorilegge fra i boschi?
dlga_lord_recruit_3_why:lord_recruit_3_d|Perché dovrei fornire supporto a {s44}?
dlga_lord_recruit_3_d:lord_recruit_3_claim|{s43}
dlga_lord_recruit_3_d:lord_recruit_3_claim.1|Se {s45} fossi {s47}, {s45} potrei occuparmi di tutti gli uomini in modo equo e difendere gli umili.
dlga_lord_recruit_3_d:lord_recruit_3_claim.2|Se {s45} fossi {s47}, {s45} potrei difendere i vostri antichi diritti di nobile in questa terra.
dlga_lord_recruit_3_d:lord_recruit_3_claim.3|Perché {s45} posso unificare le Terre del Nord e porre fine alle discordie.
dlga_lord_recruit_3_d:lord_recruit_3_claim.4|Perché {s45} vi ricompenserò con terre, per la vostra lealtà.
dlga_lord_recruit_3_d:lord_pretalk|Non importa
dlga_lord_recruit_3_claim:lord_recruit_3_claim|Non sarà che ad ogni persona dite quel che questa vuol sentirsi dire? {s12}
dlga_lord_recruit_3_claim:lord_recruit_4|{s12}
dlga_lord_recruit_3_claim:lord_pretalk|{s12}
dlga_lord_recruit_4:lord_recruit_4_objective_conditions|Vi chiedo di accordare la vostra fedeltà a {s16}.
dlga_lord_recruit_4:lord_pretalk|Niente.
dlga_lord_recruit_4_objective_conditions:lord_recruit_5_security|Fatemi pensare...
dlga_lord_recruit_5_security:lord_recruit_5_political|{s32}
dlga_lord_recruit_5_political:lord_recruit_5_ideological|{s31}
dlga_lord_recruit_5_ideological:lord_recruit_5_change_sides|{s33}
dlga_lord_recruit_5_change_sides:lord_recruit_6|{s34}
dlga_lord_recruit_6:lord_recruit_6_reaction|È tempo per voi di prendere una decisione.
dlga_lord_recruit_6:lord_pretalk|Non c'è bisogno di decidere adesso. Potremo parlare di questo in un prossimo futuro.
dlga_lord_recruit_6_reaction:lord_recruit_7_decision|Molto bene...
dlga_lord_recruit_7_decision:lord_pretalk|{s12}
dlga_lord_recruit_7_decision:lord_recruit_pledge|Molto bene, sono pronto a fare giuramento di fedeltà a {s4} come {reg4?mia Regina:mio Re}.
dlga_lord_recruit_pledge:lord_recruit_pledge|Ricordate. Mi avete promesso un feudo. Vi rammenterò quanto avete detto.
dlga_lord_recruit_pledge:lord_recruit_pledge_conclude|Così sia... Giurò fedeltà a voi come vostro leale vassallo. Sarò al vostro fianco per lottare contro i vostri nemici se avrete bisogno della mia spada, e sosterrò i vostri proclami regali e quelli dei vostri eredi legittimi... Mi aspetto che a vostra volta mi proteggiate e riconosciate i miei diritti di vassallo.
dlga_lord_recruit_pledge:lord_recruit_pledge_conclude.1|Così sia. Potete informare {s4} che ora sono un {reg4?suo:suo} leale vassallo, che seguirò {reg4?lei:lui} finchè avrò respiro, che sarò al {reg4?suo:suo} fianco per combattere in suoi nemici quando avrà bisogno della mia spada, e che sosterrò i suoi proclami regali e quelli dei suoi eredi legittimi. In cambio mi aspetto la sua protezione e il riconoscimento dei miei diritti quale suo vassallo.
dlga_lord_recruit_pledge_conclude:close_window|Ora... Si tratta di un passo importante da fare. Presenterò il mio congedo e potrebbe essere necessario un pò di tempo per prepararmi al passo succesivo.
dlga_lord_talk:denounce_lord_results|Ho fatto come avete suggerito e ho denunciato {s4}
dlga_denounce_lord_results:lord_pretalk|Si, e speriamo che ora {s4} ci penserà due volte prima di affidargli qualsiasi ulteriore feudo, onore o ufficio. Vi siamo grati.
dlga_denounce_lord_results:close_window|Così sia... Abbiamo sentito che vi ha costretto a ritrattare le vostre parole e che quindi è emerso da questa situazione più forte di prima... Mi perdonerete, {reg59?mia signora:signore}, se la mia gratitudine nei vostri confronti si sia alquanto smorzata.
dlga_lord_talk:lord_quest_intrigue_result|Ho fatto come avete chiesto e parlato con {s5} circa il pericolo rappresentato da {s4}.
dlga_lord_quest_intrigue_result:lord_pretalk|Così abbiamo sentito. Speriamo che adesso {s5} ci pensi due volte prima di affidargli qualsiasi ulteriore feudo, onore o ufficio. Vi siamo grati.
dlga_lord_quest_intrigue_result:close_window|Così abbiamo sentito... Ma ahimè, {s5} sembra che non abbia ascoltato. Comunque, vi siamo grati per aver provato.
dlga_lord_talk:lord_lend_companion_end|Vorrei che {s14} ritornasse da me, {s65}, se non sono più necessari i suoi servigi.
dlga_lord_lend_companion_end:lord_pretalk|Avete troppi uomini nella vostra Compagnia, {playername}. Non potete averne altri al momento.
dlga_lord_lend_companion_end:lord_pretalk.1|Certamente, {playername}. {reg3?Lei:Lui} è {reg3?una brillante ragazza: un brillante compagno}, ah che {reg59?donna fortunata:uomo fortunato} ad avere compagni così valorosi...
dlga_lord_talk:lord_ask_to_collect_debt|Sono qui per riscuotere il debito che avete con {s1}.
dlga_lord_ask_to_collect_debt:lord_ask_to_collect_debt_2|Oh. Bene, {s1} mi prestò del denaro, ma gli ho fatto molti favori in passato e considero quei soldi un giusto pagamento, quindi siamo pari.
dlga_lord_ask_to_collect_debt_2:convince_begin|{s1} lo considera invece un debito. È stato lui a chiedermi di parlarvi della cosa per suo conto.
dlga_lord_ask_to_collect_debt_2:lord_pretalk|Non mi soffermerò sulla questione ulteriormente.
dlga_convince_accept:close_window|Il mio debito a {s8} mi metteva a disagio visto il ritardo accumulato nel restituirlo. Grazie, accettate questa somma. Portategli questi {reg10} denari e ringraziatelo da parte mia.
dlga_lord_talk:lord_ask_to_make_peace|Vi prego, {s64}, è tempo che finisca questa guerra tra {s12} e {s13}.
dlga_lord_ask_to_make_peace:lord_ask_to_make_peace_2|Eh? Non sono sicuro di aver sentito bene, {playername}. La guerra non è cosa che si dimentica facilmente per entrambe le parti in conflitto, ed io ho una memoria molto lunga. Perché dovrei avere interesse nella pace con quei cani?
dlga_lord_ask_to_make_peace_2:convince_begin|Forse io posso parlare per lui...
dlga_lord_ask_to_make_peace_2:lord_pretalk|Non importa, la pace può aspettare per ora.
dlga_convince_accept:close_window.1|Voi... mi avete convinto, {playername}. Molto bene, avete la mia benedizione nel portare un'offerta di pace a {s14}. Non posso garantire che l'accetteranno, ma nel caso lo facessero, sarò pronto.
dlga_lord_talk:lord_challenge_duel_for_lady|Voglio lavare l'onta delle accuse contro {s1}.
dlga_lord_challenge_duel_for_lady:lord_challenge_duel_for_lady_2|Quali accuse? Sanno tutti che a lei piace concedere ad altri le sue grazie mentre suo marito è lontano. Io ripeto soltanto le parole che molti altri mormorano.
dlga_lord_challenge_duel_for_lady_2:lord_challenge_duel|Ritirerete queste menzogne, o dovrete sostenerle contro la mia spada!
dlga_lord_challenge_duel_for_lady_2:lord_pretalk|Se è in questo modo che volete porre la questione...
dlga_lord_challenge_duel:close_window|{s15}
dlga_lord_talk:lord_challenge_courtship_rival|Abbandonate le vostre mire su {s5}!
dlga_lord_challenge_courtship_rival:lord_challenge_courtship_rival_2|O cosa? Avete intenzione di duellare per una donna? Occorre che lo sappiate, il nostro signore non vede di buon occhio queste sfide tra teste calde, quando ogni uomo dovrebbe unirsi contro il nemico straniero.
dlga_lord_challenge_courtship_rival_2:lord_challenge_duel|Avete paura di combattere contro di me?
dlga_lord_challenge_courtship_rival_2:lord_pretalk|Le mie scuse. Ho parlato avventatamente...
dlga_lord_talk:message_from_lover_success|Vi porto un messaggio da {s3}.
dlga_message_from_lover_success:lord_pretalk|Grazie mille, {playername}! È bello sapere questo dalla mia signora. Ovviamente, capirete che questa cosa dovrà rimanere riservata, per preservare l'onore della signora.
dlga_lord_talk:lord_message_delivered|Porto un messaggio da {s9}.
