; dlga_minstrel_player_role_2:minstrel_player_role_3|You will have to compete with many other lords of your realm, however, who will have an advantage. They have known these ladies from childhood and have been sized up as grooms by carefully discerning mothers and aunts. Some ladies may be fascinated by the stranger, yet opt for the familiar.
dlga_minstrel_player_role_3:minstrel_prequestions|Perciò sappiate questo... Potreste ritrovarvi con il cuore spezzato. Ma entrare nell'arena dell'amore temendo il crepacuore è come scendere sul campo di battaglia temendo le frecce del nemico. Mostrate coraggio, scrollatevi di dosso le remore del rifiuto e la vittoria potrebbe essere vostra!
; dlga_minstrel_player_role:minstrel_female_player_3|Lady -- I will speak bluntly. Most of the lords of this land are looking for a demure maiden, whose skin as fair as snow -- and your skin is burnt brown by the sun. They want a maiden whose voice is soft as bells -- and your voice is hoarse from commanding men in battle. Also, although the lords of the Northlands appreciate poems about love, most also want heirs, and few women can ride and fight while with child.
dlga_minstrel_female_player_3:minstrel_prequestions|Tuttavia, non tutti i signori hanno una mentalità così convenzionale. Noi poeti cantiamo di sorelle della spada e cacciatrici, di donne che hanno forgiato il proprio destino senza tuttavia sacrificare la possibilità d'innamorarsi. Io non vi dico che per voi potrebbe essere facile trovare un marito devoto che accetti la vostra scelta di vita, ma non vi dico nemmeno che sia impossibile che ciò avvenga.
; dlga_minstrel_courtship_questions_2:minstrel_spouse_benefits|What advantage is there in seeking a {reg59?husband:wife}?
dlga_minstrel_spouse_benefits:minstrel_wife_benefits_2|Ah! Mostrate un animo romantico, vedo! Beh, a parte gli evidenti benefici dell'amore, la compagnia e altre cose, emh... Faccende domestiche, diciamo... Sposarsi nella nobiltà porta grandi vantaggi economici. Potete riuscire a forgiare una forte alleanza con la famiglia del coniuge, e una persona valida al vostro fianco può anche aiutare a manipolare la politica del regno a vostro vantaggio.
; dlga_minstrel_wife_benefits_2:minstrel_prequestions|What's more, most of the great families of the Northlands have at some point intermarried with royalty, which would boost your own claim to rule -- should you ever choose to assert it...
dlga_minstrel_spouse_benefits:minstrel_wife_benefits_2.1|Ah! Date sfoggio di gran romanticismo, vedo! Beh, a parte gli evidenti benefici amorosi, la compagnia e altre, emh, faccende domestiche... Sposarsi entro la nobiltà porta grandi vantaggi economici. Potrete aver accesso ai castelli e alle proprietà del congiunto, ed essere in grado di lavorare con chi vi sta a fianco per far avanzare entrambe le vostre posizioni nel regno.
; dlga_minstrel_player_advice_meet:minstrel_player_advice_meet_2|Every so often, a king or great lord of the Northlands will hold a feast. In towns, they will often be accompanied by tournaments. In castles, they will be accompanied by hunts. The feasts provide a chance for the lords to repair some of the rivalries that may undermine the strength of the realm. They also provide an opportunity for families to show off their eligible daughters, and ladies will often be allowed to mingle unsupervised with the guests.
dlga_minstrel_player_advice_meet_2:minstrel_prequestions|Se vi capita l'occasione, potreste riuscire a parlare con una persona che v'interessa e... Attaccare bottone, per così dire... Questo vi qualificherà come potenziale pretendente, e di solito questa persona non mancherà di farvi capire se desidera che continuiate con il corteggiamento. Per inciso, se l'approcciate dopo aver mostrato il vostro valore nel torneo o nella caccia, allora potreste fare una prima impressione migliore di altre figure presenti in queste occasioni.
dlga_minstrel_player_advice_woo:minstrel_player_advice_woo_2|Il corteggiamento di una persona richiede una certa quantità di tempo e pazienza, e diversi incontri distanziati nell'arco di vari mesi. Qualcuno realmente interessato a voi riuscirà sempre a trovare il modo di farvi sapere che desidera che andiate a porgere visita. In alternativa, potete semplicemente andare a chiedere al padre o al fratello il permesso d'incontrarvi. Se non avete il permesso del suo tutore, sarà possibile organizzare un appuntamento con altri mezzi.
; dlga_minstrel_player_advice_woo_2:minstrel_player_advice_woo_3|Having arranged an assignment, you may then attempt to charm her and win her favor. Perhaps one of the most difficult aspects of this is finding a topic of conversation. Most noblewomen lead a cloistered life, at least until they are married, and thus will have little to say that will interest you. On other hand, she will soon tire of hearing of your own deeds in the outside world.
dlga_minstrel_player_advice_woo_3:minstrel_player_advice_woo_4|Uno strumento di sicuro successo nel corteggiamento è semplicemente quello di recitare una poesia famosa, e discuterne. In questo modo entrambi saranno sullo stesso piano, e nessuno dei due avrà il vantaggio di conoscenza e d'esperienza. Naturalmente, persone diverse hanno gusti poetici differenti.
; dlga_minstrel_player_advice_woo_4:minstrel_player_advice_woo_5|At some point, you will be able to discuss directly the issue of marriage. She will then let you know if you measure up to what she wants in a husband. Some ladies will coolly assess who is the most prestigious of her suitors, while others will be guided by their passions. Some will look to your companions, to see whether you are the kind of husband who will treat her as an equal, while others will follow the lead of their fathers.
; dlga_minstrel_player_advice_woo_5:minstrel_prequestions|At any rate, it is a challenging business -- and do not forget, you may find that your suit prospers with a lady, only to have it falter on a father's political ambitions. So you must ask yourself: are you willing to risk disappointment and heartbreak? Alternately, are you willing to throw away your standing in society, to make enemies of allies, in pursuit of a forbidden love? Because if you are, then perhaps someday we will write poems about you.
dlga_minstrel_courtship_questions_2:minstrel_job_description|Cos'altro fate voi poeti e musicisti?
dlga_minstrel_job_description:minstrel_courtship_prequestions|Io compongo e scrivo canzoni per i signori del regno e le loro dame. Qualche volta canto della guerra, a volte della virtù dei Re, e talvolta, per l'auditorio più sofisticato, mi concentro sulle virtù del vino. Per la maggior parte degli ascoltatori, tuttavia, io canto l'amore.
dlga_minstrel_courtship_questions_2:minstrel_pretalk|No, è tutto.
dlga_minstrel_prequestions:minstrel_courtship_questions_2|Avete altre domande?  
dlga_minstrel_pretalk:minstrel_1|C'è qualcos'altro che vorreste sapere?
; dlga_start:farmer_from_bandit_village_1|{reg59?My lady:My lord}, you look like a {reg59?lady:man} of the sword and someone who could help us. Will you hear my plea?
dlga_farmer_from_bandit_village_1:farmer_from_bandit_village_2|Cosa vi turba? Parlate!
; dlga_farmer_from_bandit_village_1:farmer_from_bandit_village_2.1|What are you babbling about, peasant? Speak up.
; dlga_farmer_from_bandit_village_2:farmer_from_bandit_village_3|A band of brigands has taken refuge in our village. They take everything we have, force us to serve them, and do us much evil. If one of us so much as breathes a word of protest, they kill the poor soul on the spot right away. Our lives have become unbearable. I risked my skin and ran away to find someone who can help us.
dlga_farmer_from_bandit_village_3:farmer_from_bandit_village_4|Perché non fate richiesta al signore del vostro villaggio? Lui dovrebbe prendersi cura dei suoi sudditi.
; dlga_farmer_from_bandit_village_4:farmer_from_bandit_village_5|I did, {reg59?my lady:my lord}, but our lord's men did not let me see him and said he was occupied with more important matters and that we should deal with our own problem ourselves. Please {reg59?my lady:my lord}, you look like a {reg59?lady:man} of valor and a fearsome warrior, and you have no doubt many friends and soldiers at your service. If there is anyone who can help us, it's you.
dlga_farmer_from_bandit_village_5:farmer_from_bandit_village_accepted|Essia, vi aiuterò. Dov'è questo villaggio?
dlga_farmer_from_bandit_village_5:farmer_from_bandit_village_denied|Non posso aiutarvi adesso.
dlga_farmer_from_bandit_village_5:farmer_from_bandit_village_barter|Perché dovrei combattere contro questi banditi? Cosa ne avrei in cambio?
; dlga_farmer_from_bandit_village_accepted:close_window|God bless you, {reg59?lady:lord}. Our village is {s7}. It is not too far from here.
; dlga_farmer_from_bandit_village_denied:close_window|As you say, {reg59?my lady:my lord}. Forgive me for bothering you.
; dlga_farmer_from_bandit_village_barter:farmer_from_bandit_village_5|We are but poor farmers, {reg59?my lady:my lord}, and the bandits have already taken most of what we had in this world, but we'll be glad to share with you whatever we have left, and we'll always be in gratitude to you if you help us.
; dlga_start:close_window.89|Thank you for helping us, {reg59?my lady:my lord}. Crush those bandits!
dlga_start:mercenary_tavern_talk01|{s4}
; dlga_mercenary_tavern_talk01:mercenary_tavern_talk02|You seem somebody strong and accustomed to hard life. I am interested in recruiting you.
dlga_mercenary_tavern_talk01:close_window|Mi dispiace, non era mia intenzione disturbarti. Addio.
; dlga_mercenary_tavern_talk02:close_window|Don't you see I am busy? I do not have time or inclination to join you.^^(You need 150 renown to recruit high-level troops).
; dlga_mercenary_tavern_talk02:mercenary_tavern_talk|We are traveling through these lands, but we might consider staying if you hire us, {reg59?madam:sir}. {reg3?Me and {reg4?{reg3} of my mates:one of my mates}:I} will join you for {reg5} peningas.
; dlga_start:mercenary_after_recruited|Any orders, {reg59?madam:sir}?
dlga_mercenary_after_recruited:mercenary_after_recruited_2|Preparatevi. Ci muoveremo all'alba.
dlga_mercenary_after_recruited:mercenary_after_recruited_2.1|Avete del tempo per decidere. Noi resteremo in città per un pò di tempo.
; dlga_mercenary_after_recruited_2:close_window|Yes {reg59?madam:sir}. We'll be ready when you tell us to leave.
; dlga_mercenary_tavern_talk:mercenary_tavern_talk_hire|All right, I will hire you. Here are {reg5} peningas.
; dlga_mercenary_tavern_talk:mercenary_tavern_talk_hire.1|All right, but I can only hire {reg6} of you. Here are {reg5} peningas.
dlga_mercenary_tavern_talk_hire:close_window|{s17}
; dlga_mercenary_tavern_talk:tavern_mercenary_cant_lead|That sounds good, but I can't afford to hire any more men right now.
dlga_tavern_mercenary_cant_lead:close_window|Comprendo. Bene, {reg3?noi aspetteremo:io aspetterò} qui per un pò di tempo, se cambiate idea sull'assoldare qualcuno.
; dlga_mercenary_tavern_talk:tavern_mercenary_cant_lead.1|That sounds good, but I can't lead any more men right now.
dlga_mercenary_tavern_talk:close_window|Spiacente. Adesso non ho bisogno di assoldare altri uomini.
dlga_start:dungeon_reply1|Stai attento! Non mi muoverò fino a quando non sarò tutto finito.
dlga_dungeon_reply1:dungeon_reply2|Ucciderò tutti i banditi, e tu sarai libero
dlga_dungeon_reply2:close_window|Grazie {reg59?lady:sire}. Non lo dimenticherò mai! 
; dlga_start:trainer_intro_11|Good day to you, {reg59?lass:lad}. The captain hired me to protect his ship. Here, on matters of defense, my word is the law.
dlga_trainer_intro_11:trainer_intro_21|Capisco. Tu dovresti essere il veterano. Posso imparare qualcosa sul combattimento da te?
dlga_trainer_intro_11:close_window|Piacere di conoscerti. Ritornerò più tardi.
; dlga_trainer_intro_21:trainer_intro_31|Indeed, you can. I don't have anything better to do while we aren't in combat! I can find you some opponents to practice with if you like. Or if you have any questions about theory of combat, feel free to ask.
; dlga_trainer_intro_31:trainer_intro_41a|As a matter of fact, I do have a few questions.
dlga_trainer_intro_31:trainer_intro_41b|Posso iniziare ad addestrarmi.
dlga_trainer_intro_41a:trainer_talk_combat1|Bene, chiedete pure quello che vi pare.
dlga_trainer_intro_41b:trainer_practice_11|Ottimo. È bello trovare qualcuno con l'ansia di fare pratica. Vediamo quello che sapete fare.
dlga_start:trainer_practice_11|È stato un buon combattimento.
; dlga_start:trainer_practice_11.1|Ha! Looks like you've developed a bit of a limp there. Don't worry. Even losses have their value, provided you learn from them. Shake the stars out of your eyes and get back in there. There's no other way to win.
dlga_start:trainer_talk2|Buongiorno. Siamo pronti per l'addestramento di oggi?
; dlga_trainer_pretalk2:trainer_talk2|Well, are you ready for some training?
dlga_trainer_talk2:trainer_practice_11|Non vedo l'ora d'iniziare l'addestramento!
dlga_trainer_talk2:trainer_combat_begin1|Prima, ditemi qualcosa sul combattimento...
dlga_trainer_talk2:close_window|Ora devo andare via. Addio e grazie.
dlga_trainer_combat_begin1:trainer_talk_combat1|Cosa volete sapere?
dlga_trainer_combat_pretalk:trainer_talk_combat1|Cos'altro volete sapere?
; dlga_trainer_talk_combat1:trainer_explain_combat|Tell me about combat.
; dlga_trainer_talk_combat1:trainer_pretalk2|I guess I know all theory I need. Let's talk about something else.
dlga_trainer_explain_combat:trainer_explain_combat_2|Bella domanda. La prima cosa che dovete conoscere come combattente è come difendervi. Tenersi lontano da possibili danni è la prima regola di combattimento, ed è molto più importante che causare danni agli altri. Tutti possono usare una spada per causare danni, ma solamente i combattenti esperti sanno anche difendersi dai colpi in arrivo.
dlga_trainer_explain_combat_2:trainer_explain_combat_3|Ora, difendersi è più facile se avete uno scudo. Bloccate gli attacchi con lo scudo. [Tieni premuto il tasto destro del mouse per alzare lo scudo e difenderti.] In questo modo, siete capace di deviare tutti gli attacchi frontali ma avrete i lati scoperti e anche dietro sarete vulnerabile.
dlga_trainer_explain_combat_3:trainer_explain_combat_4|Come faccio se non ho uno scudo?
; dlga_trainer_explain_combat_4:trainer_explain_combat_5|Then you will have to use your weapon to block your opponent. This is a bit more difficult than defending with a shield. Defending with a weapon, you can block against only ONE attack direction. That is, you block against either overhead swings, side swings or thrusts. Therefore, you must watch your opponent carefully and start to block AFTER he starts his attack. In this way, you will be able to block against the direction of his current attack. If you start to block BEFORE he makes his move, he may just attack in another direction than the one you are blocking against and score a hit.
; dlga_trainer_explain_combat_5:trainer_explain_combat_6|Finally, Attacking is the best defence, they say. A tactic many fighters find useful is taking an offensive stance and readying your weapon for attack, waiting for the right moment for swinging it. [You can ready your weapon for attack by pressing and holding down the left mouse button.]
dlga_trainer_explain_combat_6:trainer_explain_combat_7|Ecco una cosa utile.
dlga_trainer_explain_combat_7:trainer_explain_combat_8|È una buona tattica, ma ricordate che il vostro avversario vedrà il tipo d'attacco che state per sferrare e prenderà una posizione difensiva per contrastarvi. Se accade questo, dovete annullare il vostro attacco e rapidamente attaccare in un'altra direzione. [Puoi annullare il vostro attacco premendo rapidamente il tasto del mouse corretto.]
dlga_trainer_explain_combat_8:trainer_explain_combat_9|Se il mio avversario si sta difendendo contro la direzione in cui sto attaccando, annullerò il mio attacco ed userò un'altra direzione per il nuovo attacco.
; dlga_trainer_explain_combat_9:trainer_pretalk2|Yes, selecting the direction you swing your weapon is a crucial skill. There are four main directions you may use: right swing, left swing, overhead swing and thrust. You must use each one wisely. [To control your swing direction with default controls, move your mouse in the direction you want to swing from as you press the left mouse button].
; dlga_trainer_practice_11:trainer_practice_11|If I may say so, I see great warrior in you. ^^Some sailors have been idle since we stopped. Let's see if one of them could help us.
; dlga_trainer_practice_11:novicemaster_are_you_ready1|A sailor will fight you. Are you ready?
dlga_novicemaster_are_you_ready1:novicemaster_ready_to_fight1|Si, cominciamo.
dlga_novicemaster_ready_to_fight1:close_window|Potete iniziare. Buona fortuna.
; dlga_novicemaster_are_you_ready1:novicemaster_not_ready1|Just a moment. I am not ready yet.
; dlga_novicemaster_not_ready1:close_window|Hey, you will never make it if you don't practice.
; dlga_start:close_window.90|Please, kind {reg59?madame:sir}, help us! I don't want to be a slave!
; dlga_start:bodo_prisoner_sl|Hi {playername}. Glad to see you are alive. I thought you were killed when Sven Bull Neck's men attacked us. I was not so lucky, as you can see.
; dlga_bodo_prisoner_sl:bodo_prisoner_s2|Bodo! What? Where is my mother? And who are these women?
; dlga_bodo_prisoner_sl:close_window|Let me get you out of here, my friend, and then we'll talk.
; dlga_bodo_prisoner_s2:close_window|We can't talk here; there are too many ears listening. Get me out of here, and I will tell you everything.
; dlga_start:close_window.91|Please, kind {reg59?madame:sir}, help us. I don't want to be a slave.
; dlga_start:bodo_merchant_1|Good day, {playername}. It is good to see that you are well. You were giving us a fright, talking in your sleep. I'd hate to be the one troubled by such dreams...
; dlga_bodo_merchant_1:bodo_merchant_2|I'm fine, thank you. No one has need to worry.
dlga_bodo_merchant_1:bodo_merchant_22|{s10}
; dlga_bodo_merchant_1:bodo_merchant_21|Well, I can't see how my affairs are anyone else's business!
; dlga_bodo_merchant_2:bodo_merchant_3|Perhaps not. At any rate, it's good to see you up and about, friend.
dlga_bodo_merchant_22:bodo_merchant_3|{s2}
; dlga_bodo_merchant_21:bodo_merchant_3|No need to get angry! I was just speaking as a friend. It's just good to see you up and about.
; dlga_bodo_merchant_3:bodo_merchant_4a|Remind me who you are. To tell the truth, my mind is still a little foggy.
; dlga_bodo_merchant_3:close_window|Thanks! Now I'm going to help check out those ships. Farewell for now.
; dlga_bodo_merchant_4a:bodo_merchant_5|Why, I am Bodo. I hail from Cantabria, in the Kingdom of Asturias, in the north of the land that the Romans called Hispania. We've become well acquainted on this voyage.
; dlga_bodo_merchant_5:bodo_merchant_6|Then I know you've told me your story, but I'd like to hear it again.
; dlga_bodo_merchant_5:close_window|Oh, that's right... Bodo. Well, I go now to help check out those ships. Farewell for now.
; dlga_bodo_merchant_6:bodo_merchant_7|Perhaps some other time. I think right now I want to keep an eye on the horizon. I'm not as convinced as the captain that stopping here is a good idea.
; dlga_start:close_window.92|I thought I saw something a minute ago, but the mist over these waters plays tricks on the eyes... Probably nothing. I hope it's nothing. This ship's fast enough, but can't outrun a warship.
; dlga_bodo_merchant_7:bodo_merchant_8|I'm worried as well. I'm glad you are watching, my friend.
; dlga_bodo_merchant_7:close_window|What could be the harm of it? But to speed things along, I will help check out those ships.
; dlga_bodo_merchant_8:close_window|And I'm glad to do it for you. We've become such good friends on this trip, I'm sorry we will soon part. If we meet again in the future and you need my help, you have it, my friend.
; dlga_start:esposabarco_1|{s2}^^My {reg59?daughter:son}, it is such a nice day! The sea is so bright! It is truly a pity to have all these shipwrecks spoil the scene!
; dlga_esposabarco_1:esposabarco_12|Yes, Mother. I'm glad you are well today.
; dlga_esposabarco_1:esposabarco_11|You remember me? That's wonderful!
; dlga_esposabarco_1:close_window|I will see you later, Mother.
; dlga_esposabarco_12:esposabarco_13|{s2}^^Not only well but happy! I'm glad we made this trip, but we must remember to be home to make dinner! Your father will expect it.
; dlga_esposabarco_11:esposabarco_13|{s2}^^You are my baby. I am your mother. Why would I or Father forget you?
; dlga_esposabarco_13:esposabarco_14|But... Father is dead.
; dlga_esposabarco_13:close_window|Mother, we are going home right now. I love you.
; dlga_esposabarco_14:esposabarco_15|{s2}^^But... But... We aren't on a trip near home, are we? My head hurts so much, I don't remember where home is! I know who you are, but I don't remember your name. Am I crazy?
; dlga_esposabarco_15:esposabarco_16|No, you've only forgotten a few things.
; dlga_esposabarco_15:esposabarco_17|No, you're just sick. But soon we will see someone that will make you better.
; dlga_esposabarco_15:close_window|Yes, but we're getting help for you. Farewell, then, for the moment.
; dlga_esposabarco_16:close_window|{s2}^^Oh dear. I think I need a moment alone. Please go.
; dlga_esposabarco_17:esposabarco_18|{s2}^^I am not so sure that anybody can heal this, my {reg59?daughter:son}.
; dlga_esposabarco_18:close_window|We are almost there! Please don't give up now. We'll talk more later.
; dlga_start:close_window.93|I'd like to chat, but I must complete my chores now.
; dlga_start:sailors_merchant_1|Ic grete thee, {playername}. I'd like to chat, but I must complete my chores now. We will talk later.
; dlga_sailors_merchant_1:close_window|Very well. We will talk tonight at the anchorage.
; dlga_start:close_window.94|[Enemy lookouts watch you closely from the walls of Readingum.]
; dlga_start:arquerosb_merchant_1|Talk to the boss, {playername}, that veteran in the prow of the boat over there. He's the one that can best train you in fighting.
dlga_arquerosb_merchant_1:close_window|Grazie, lo farò.
dlga_start:frisianship_merchant_1|West thu hal, {playername}. Stai bene oggi? Ti muovevi continuamente nel sonno e dicevi cose incomprensibili. I miei marinai pensavano che eri come tormentato da uno spirito.
dlga_frisianship_merchant_1:frisianship_merchant_2|Dove sono? Che posto è questo?
dlga_frisianship_merchant_2:frisianship_merchant_3|Oh, questo è male. Non ricordi niente? Il mio nome è Avo, leof. Io sono il capitano di questa nave, la Woden Ric. Imbarcasti con noi a Friese alcune settimane fa, ci hai pagato bene per prenderti con noi.
dlga_frisianship_merchant_3:frisianship_merchant_4a|Si, ora ricordo.
; dlga_frisianship_merchant_3:frisianship_merchant_4b|Oh, it's coming back to me now, but perhaps you can remind me why am I here?
dlga_frisianship_merchant_4a:frisianship_merchant_5|Beh, non preoccuparti. Queste cose succedono a tutti.
dlga_frisianship_merchant_4b:frisianship_merchant_5|Ora sto davvero iniziando a preoccuparmi per te. Non conosco i dettagli, ma so che ti preoccupi per tua madre. Lei è malato, e si stavano prendendo il suo ad un prete di grande capacità di guarigione nel porto della Frisia dove stiamo andando.
dlga_frisianship_merchant_5:frisianship_merchant_6|Grazie! Ma c'è una luce fuori. Non dovremmo navigare a vele spiegate? La barca non si muove! Cosa sta succedendo? Perché ci siamo fermati?
dlga_start:close_window.95|Possiamo parlare più tardi, {reg59?signora:signore}? Ho bisogno di dare alcuni ordini ai miei uomini.
dlga_start:frisianship_merchant_talk|Buona giornata. Siamo pronti a intrecciare. Sei pronto?
dlga_frisianship_merchant_talk:frisianship_merchant_1x|Io sono pronto. Per favore, continuiamo il nostro viaggio.
dlga_frisianship_merchant_talk:close_window|No, ho bisogno di fare qualcosa prima di andarcene.
dlga_frisianship_merchant_1x:frisianship_merchant_2x|{s2}^^Siamo stati insieme in questo viaggio del tempo. Vuoi provare il timone? Lei dirige molto agilmente per una nave mercantile.
dlga_frisianship_merchant_2x:close_window|Perché, mi chiedevo quando l'avresti chiesto!
dlga_frisianship_merchant_2x:close_window.1|No. Credetemi, penso che avrebbe voluto toccarlo solo l'ultima risorsa!
dlga_frisianship_merchant_6:frisianship_merchant_7|Abbiamo trovato un po' di rottami, alcune navi metà-affondate. A quanto pare, c'era una lotta qui recentemente. Ho i miei uomini il check-out la situazione e alla ricerca di sopravvissuti. Poveri bastardi avrebbe avuto una possibilità contro le lunghe navi vichinghe. Saremo sul nostro modo abbastanza presto, anche se.
dlga_frisianship_merchant_7:frisianship_merchant_8|Oh. Potremmo abbiamo fretta lungo? Chiunque abbia affondato quelle navi potrebbe essere ancora nelle vicinanze.
dlga_frisianship_merchant_7:close_window|Bene, finalmente un po' di eccitazione! Penso che andrò a aiutarli.
dlga_frisianship_merchant_8:frisianship_merchant_9|{s2}^^Relax, {reg59?donna:uomo}. Il tuo amico, Bodo, ha insistito per la guardia. Dubito che quel tizio non trova mai una cosa del genere!
dlga_frisianship_merchant_9:frisianship_merchant_10|Bodo? Sì. Beh, sono ancora preoccupato.
dlga_frisianship_merchant_9:frisianship_merchant_11|Spero che sai quello che stai facendo.
dlga_frisianship_merchant_10:close_window|{s2}^^se tu fossi stato in una di quelle navi anziché questo, noi di smettere, ora vorreste non e ' vero? È la legge del mare -- soprattutto questo mare.
